"location","source","target","id","fuzzy","context","translator_comments","developer_comments"
"Content/Story/Missions/DIA_GRD_251_Kirgo.d:27","Proszę, proszę. Nowa twarz. Dopiero co cię wrzucili?","No podívejme se, nová tvář. Právě tě sem hodili?","","False","Kirgo-CH0-None-Kirgo-13159","",""
"Content/Story/Missions/DIA_GRD_251_Kirgo.d:29","Nie twój interes.","To tě nemusí zajímat.","","False","DIA_GRD_251_Kirgo_Hello_Info.DIA_GRD_251_Kirgo_Hello.DIA_GRD_251_Kirgo_Hello_Not_Your_Business","AI_AddChoice",""
"Content/Story/Missions/DIA_GRD_251_Kirgo.d:30","Tak.","Ano.","","False","DIA_GRD_251_Kirgo_Hello_Info.DIA_GRD_251_Kirgo_Hello.DIA_GRD_251_Kirgo_Hello_Yes","AI_AddChoice",""
"Content/Story/Missions/DIA_GRD_251_Kirgo.d:37","Tak.","Ano.","","False","Kirgo-CH0-None-Hero-61590","",""
"Content/Story/Missions/DIA_GRD_251_Kirgo.d:38","No to witaj w Kolonii. Jak ci na imię? Mnie nazywają Kirgo.","Tak tedy: Vítej v Kolonii. Jak se jmenuješ? Já jsem Kirgo.","","False","Kirgo-CH0-None-Kirgo-72322","",""
"Content/Story/Missions/DIA_GRD_251_Kirgo.d:39","Nyras.","Nyras.","","False","Kirgo-CH0-None-Hero-54970","",""
"Content/Story/Missions/DIA_GRD_251_Kirgo.d:40","Miło poznać. Może chwilę porozmawiamy? Powiedz mi, jak się sprawy mają na zewnątrz, a ja zdradzę ci parę rzeczy, które ułatwią ci przeżycie w tej dziurze.","Rád tě poznávám. Hej, co takhle si trochu popovídat? Řekni mi něco o vnějším světě a já ti dám pár tipů, jak tady uvnitř zůstat naživu.","","False","Kirgo-CH0-None-Kirgo-53995","",""
"Content/Story/Missions/DIA_GRD_251_Kirgo.d:41","Cały dzień przerzucam ten cholerny gruz. Chciałbym się na chwilę od tego oderwać... To jak, pogadamy?","Celý den pracuju na tom sesuvu a potřeboval bych trošku rozptýlit. Co ty na to?","","False","Kirgo-CH0-None-Kirgo-48505","",""
"Content/Story/Missions/DIA_GRD_251_Kirgo.d:47","Nie mam na to czasu.","Na tohle nemám čas.","","False","DIA_GRD_251_Kirgo_Hello_Yes.DIA_GRD_251_Kirgo_Hello.DIA_GRD_251_Kirgo_Hello_No_Time","AI_AddChoice",""
"Content/Story/Missions/DIA_GRD_251_Kirgo.d:48","No trudno.","Ach tak.","","False","DIA_GRD_251_Kirgo_Hello_Yes.DIA_GRD_251_Kirgo_Hello.DIA_GRD_251_Kirgo_Hello_Too_Bad","AI_AddChoice",""
"Content/Story/Missions/DIA_GRD_251_Kirgo.d:49","A może opowiem ci w zamian za bezpieczny nocleg?","Co takhle když ti to řeknu a ty mi za to najdeš bezpečné místo na spaní?","","False","DIA_GRD_251_Kirgo_Hello_Yes.DIA_GRD_251_Kirgo_Hello.DIA_GRD_251_Kirgo_Hello_Story_For_A_Place_To_Sleep","AI_AddChoice",""
"Content/Story/Missions/DIA_GRD_251_Kirgo.d:50","Dlaczego w ogóle obchodzi cię, co się dzieje na zewnątrz?","Proč tě vůbec zajímá, co se děje venku? Už se odsud nikdy nedostaneme, že jo?","","False","DIA_GRD_251_Kirgo_Hello_Yes.DIA_GRD_251_Kirgo_Hello.DIA_GRD_251_Kirgo_Hello_Why_Are_You_Interested_In_This","AI_AddChoice",""
"Content/Story/Missions/DIA_GRD_251_Kirgo.d:56","Dlaczego w ogóle obchodzi cię, co się dzieje na zewnątrz? Przecież i tak się stąd nie wydostaniemy.","Proč tě vůbec zajímá, co se děje venku? Už se odsud nikdy nedostaneme, že jo?","","False","Kirgo-CH0-None-Hero-5576","",""
"Content/Story/Missions/DIA_GRD_251_Kirgo.d:57","Ludzie z Nowego Obozu i typy żyjące na bagnie twierdzą inaczej. Ale masz rację, pewnie spędzimy tu resztę życia.","No, chlapi z Nového tábora a z tábora v bažinách to vidí jinak. Ale ano, máš pravdu, nejspíš ne.","","False","Kirgo-CH0-None-Kirgo-48595","",""
"Content/Story/Missions/DIA_GRD_251_Kirgo.d:58","Ja tam uważam, że warto sobie czasem przypomnieć, że świat nie kończy się na tej zasranej, niebieskiej kopule. Inaczej bym zwariował.","Ale rád si občas připomínám, že svět není jen pod Bariérou. Jinak bych se už dávno zbláznil.","","False","Kirgo-CH0-None-Kirgo-58994","",""
"Content/Story/Missions/DIA_GRD_251_Kirgo.d:64","A może ci opowiem w zamian za bezpieczny nocleg?","Co takhle když ti to řeknu a ty mi za to najdeš bezpečné místo na spaní?","","False","Kirgo-CH0-None-Hero-57845","",""
"Content/Story/Missions/DIA_GRD_251_Kirgo.d:65","Może jedna z tych waszych chatek?","Možná v jedné z vašich chatrčí.","","False","Kirgo-CH0-None-Hero-75065","",""
"Content/Story/Missions/DIA_GRD_251_Kirgo.d:66","Boisz się cieniostwora, co? Pozwoliłbym ci, gdyby to zależało ode mnie, ale tak nie jest. Przykro mi.","Kvůli té stínové šelmě, co? Kdyby to bylo na mně, nebyl by to problém, ale na mně to není. Je mi líto.","","False","Kirgo-CH0-None-Kirgo-5289","",""
"Content/Story/Missions/DIA_GRD_251_Kirgo.d:73","No trudno.","Ach tak.","","False","Kirgo-CH0-None-Hero-75802-0","",""
"Content/Story/Missions/DIA_GRD_251_Kirgo.d:73","Szczerze, to nawet nie ma co tu dużo opowiadać. Każdy sra w gacie z powodu wojny, a wszystkie chore historie o orkach też nie pomagają.","Abych byl upřímný, není toho moc, co bych ti mohl říct. Všichni jsou kvůli válce nervózní a všechny ty strašidelné příběhy o skřetech to nezlepšují.","","False","Kirgo-CH0-None-Hero-49599-0","",""
"Content/Story/Missions/DIA_GRD_251_Kirgo.d:74","Krąży jednak plotka, że Nordmarczycy odnieśli kilka małych zwycięstw. I tyle.","Ale tvrdí se, že Nordmařané zvítězili v pár bitvách - takže to není všechno špatné.","","False","Kirgo-CH0-None-Hero-7847","",""
"Content/Story/Missions/DIA_GRD_251_Kirgo.d:75","Chwała Innosowi. Miejmy nadzieję, że uda im się odzyskać część kopalń. Nie ma znaczenia, ilu więźniów wyśle tu król – na dłuższą metę nie ma szans, żebyśmy nadążyli za popytem.","Díky Innosovi. Doufejme, že dokáží získat zpátky pár dolů - nemůžeme dlouhodobě uspokojit královu poptávku, ať už nám pošle kolik vězňů chce.","","False","Kirgo-CH0-None-Kirgo-86946","",""
"Content/Story/Missions/DIA_GRD_251_Kirgo.d:76","A co z Khorinis? Miałeś szansę zobaczyć miasto, gdy cię tu przewozili?","A co město Khorinis? Viděl jsi něco z města, když tě sem přivedli?","","False","Kirgo-CH0-None-Kirgo-51889","",""
"Content/Story/Missions/DIA_GRD_251_Kirgo.d:78","Niestety nie. Przez cały czas byłem zamknięty.","Skoro nic. Celou tu dobu jsem byl v lochu.","","False","Kirgo-CH0-None-Hero-69630","",""
"Content/Story/Missions/DIA_GRD_251_Kirgo.d:78","Szkoda. Brakuje mi tego miasta. Mieszkałem tam przez kilka lat po opuszczeniu Varantu. Miałem nawet kobietę... Rosę.","Škoda. Jak mi to město chybí... Žil jsem tam několik let, když jsem opustil Varant. Dokonce tam měl i jednu holku...","","False","Kirgo-CH0-None-Kirgo-15646","",""
"Content/Story/Missions/DIA_GRD_251_Kirgo.d:79","Nie wyobrażam sobie słodszej istoty. Była lepszym człowiekiem, niż ja kiedykolwiek będę.","Rosa... ta nejmilejší holka, jakou si dokážeš představit. A lepší člověk, než kdy budu já.","","False","Kirgo-CH0-None-Kirgo-28860-0","",""
"Content/Story/Missions/DIA_GRD_251_Kirgo.d:82","Cholera, znowu zaczynam biadolić jak stary dziad. Wybacz.","A sakra. Už tu zase mektám jako stařec, promiň.","","False","Kirgo-CH0-None-Kirgo-50097","",""
"Content/Story/Missions/DIA_GRD_251_Kirgo.d:83","Czy to prawda, że w ogóle nie ma tu kobiet?","Je pravda, že tady nejsou žádné ženy? Vůbec žádné?","","False","DIA_GRD_251_Kirgo_Hello_Too_Bad.DIA_GRD_251_Kirgo_Hello.DIA_GRD_251_Kirgo_Hello_About_Women","AI_AddChoice",""
"Content/Story/Missions/DIA_GRD_251_Kirgo.d:87","Twoja kolej. Jakie masz dla mnie rady?","Teď jsi na řadě ty. Jaká je tvoje rada?","","False","DIA_GRD_251_Kirgo_Hello_Too_Bad.DIA_GRD_251_Kirgo_Hello.DIA_GRD_251_Kirgo_Hello_Any_Advice","AI_AddChoice",""
"Content/Story/Missions/DIA_GRD_251_Kirgo.d:93","Nie mam na to czasu.","Na tohle nemám čas.","","False","Kirgo-CH0-None-Hero-42421","",""
"Content/Story/Missions/DIA_GRD_251_Kirgo.d:98","Hm, szkoda. No ale jak wolisz.","Škoda. Dobrá tedy, jak myslíš.","","False","Kirgo-CH0-None-Kirgo-13085","",""
"Content/Story/Missions/DIA_GRD_251_Kirgo.d:104","Nie twój interes.","To tě nemusí zajímat.","","False","Kirgo-CH0-None-Hero-73711","",""
"Content/Story/Missions/DIA_GRD_251_Kirgo.d:104","Nie jesteś specjalnie rozmowny, co? Mnie to lata, ale radzę spuścić z tonu. Samotnicy szybko tu giną.","Moc toho nenamluvíš, co? V pohodě, ale na tvém místě bych si dalpozor. Samotáři se moc daleko nedostanou.","","False","Kirgo-CH0-None-Kirgo-8473","",""
"Content/Story/Missions/DIA_GRD_251_Kirgo.d:113","Twoja kolej. Jakie masz dla mnie rady?","Teď jsi na řadě ty. Jaká je tvoje rada?","","False","Kirgo-CH0-G1RDemo_KirgoFight-Hero-99779","",""
"Content/Story/Missions/DIA_GRD_251_Kirgo.d:113","Dołącz do Starego Obozu. Jesteśmy sercem Kolonii. Wszystko, co wysyłają nam z zewnątrz, trafia do nas.","Přidej se ke Starému táboru. Jsme přímo u zdroje zboží přicházejícího z vnějšího světa.","","False","Kirgo-CH0-G1RDemo_KirgoFight-Kirgo-70361","",""
"Content/Story/Missions/DIA_GRD_251_Kirgo.d:115","Chyba że osuną się skały...","Pokud nedojde k sesuvu...","","False","Kirgo-CH0-G1RDemo_KirgoFight-Hero-25026","",""
"Content/Story/Missions/DIA_GRD_251_Kirgo.d:115","Nie przejmuj się tym. Nasi chłopcy uporają się z tym w mgnieniu oka. Gomez jest surowy, ale wie, jak zarządzać tym miejscem.","Ha! Nestrachuj se, naši hoši to odklidí, ani nemkrneš. Gomez je tvrďák, ale ví, jak zařídit, aby všechno klapalo.","","False","Kirgo-CH0-G1RDemo_KirgoFight-Kirgo-58252","",""
"Content/Story/Missions/DIA_GRD_251_Kirgo.d:117","Gomez? To twój szef?","Gomez je tvůj šéf?","","False","Kirgo-CH0-G1RDemo_KirgoFight-Hero-59810","",""
"Content/Story/Missions/DIA_GRD_251_Kirgo.d:117","Jest najbardziej wpływowym człowiekiem w Starym Obozie. Poprowadził bunt więźniów i teraz tam rządzi.","Je to ten nejmocnější muž ve Starém táboře. Vedl vzpouru a převzal vedení.","","False","Kirgo-CH0-G1RDemo_KirgoFight-Kirgo-34033","",""
"Content/Story/Missions/DIA_GRD_251_Kirgo.d:119","To on mówi królowi, czego chcemy w zamian za rudę, a król to dostarcza.","To je ten člověk, který říká králi, co chceme za naši rudu. A král to dodá.","","False","Kirgo-CH0-G1RDemo_KirgoFight-Kirgo-18590","",""
"Content/Story/Missions/DIA_GRD_251_Kirgo.d:120","Rozumiem.","Rozumím.","","False","Kirgo-CH0-G1RDemo_KirgoFight-Hero-26319","",""
"Content/Story/Missions/DIA_GRD_251_Kirgo.d:120","Jeszcze jedno. Wyglądasz na kogoś, kto potrafi posługiwać się mieczem. Co powiesz na mały sparing?","Počkej, vypadáš, jako bys už někdy v ruce držel meč. Chceš si trochu zacvičit?","","False","Kirgo-CH0-G1RDemo_KirgoFight-Kirgo-52548","",""
"Content/Story/Missions/DIA_GRD_251_Kirgo.d:123","W przyszłym tygodniu czeka mnie walka. W zamian nauczę cię kilku sztuczek.","Příští týden budu bojovat v aréně, mohl bych ti na oplátku ukázat pár triků.","","False","Kirgo-CH0-G1RDemo_KirgoFight-Kirgo-630","",""
"Content/Story/Missions/DIA_GRD_251_Kirgo.d:125","Może za chwilę.","Možná později.","","False","DIA_GRD_251_Kirgo_Hello_Any_Advice.DIA_GRD_251_Kirgo_Hello.DIA_GRD_251_Kirgo_Hello_Maybe_Later","AI_AddChoice",""
"Content/Story/Missions/DIA_GRD_251_Kirgo.d:126","Dobrze, czemu nie.","Jasně, proč ne.","","False","DIA_GRD_251_Kirgo_Hello_Any_Advice.DIA_GRD_251_Kirgo_Hello.DIA_GRD_251_Kirgo_Hello_Why_Not","AI_AddChoice",""
"Content/Story/Missions/DIA_GRD_251_Kirgo.d:127","Wybacz, ale muszę lecieć.","Promiň, ale vážně musím jít.","","False","DIA_GRD_251_Kirgo_Hello_Any_Advice.DIA_GRD_251_Kirgo_Hello.DIA_GRD_251_Kirgo_Hello_Sorry_But_No","AI_AddChoice",""
"Content/Story/Missions/DIA_GRD_251_Kirgo.d:131","„Czeka cię walka”?","Bojovat v aréně?","","False","DIA_GRD_251_Kirgo_Hello_Any_Advice.DIA_GRD_251_Kirgo_Hello.DIA_GRD_251_Kirgo_Hello_Are_You_Going_To_Fight","AI_AddChoice",""
"Content/Story/Missions/DIA_GRD_251_Kirgo.d:134","„Czeka cię walka”?","Bojovat v aréně?","","False","Kirgo-CH0-G1RDemo_KirgoFight-Hero-1372","",""
"Content/Story/Missions/DIA_GRD_251_Kirgo.d:138","Tak, na arenie. Będziesz mógł ją zobaczyć.","Ano, ve Starém táboře. Brzo uvidíš.","","False","Kirgo-CH0-G1RDemo_KirgoFight-Kirgo-68105","",""
"Content/Story/Missions/DIA_GRD_251_Kirgo.d:145","Wybacz, ale muszę lecieć.","Vážně musím jít.","","False","Kirgo-CH0-G1RDemo_KirgoFight-Hero-91130","",""
"Content/Story/Missions/DIA_GRD_251_Kirgo.d:151","Trudno. Może innym razem.","Škoda. No, možná jindy.","","False","Kirgo-CH0-G1RDemo_KirgoFight-Kirgo-3837","",""
"Content/Story/Missions/DIA_GRD_251_Kirgo.d:154","Dobrze, czemu nie.","Jasně, proč ne.","","False","Kirgo-CH0-G1RDemo_KirgoFight-Hero-95013","",""
"Content/Story/Missions/DIA_GRD_251_Kirgo.d:158","Świetnie! Daj znać, jak będziesz gotowy.","Výborně! Dej mi vědět, až budeš připraven.","","False","Kirgo-CH0-G1RDemo_KirgoFight-Kirgo-63047","",""
"Content/Story/Missions/DIA_GRD_251_Kirgo.d:162","Może za chwilę.","Možná později.","","False","DIA_GRD_251_Kirgo_Hello_Why_Not.DIA_GRD_251_Kirgo_Hello.DIA_GRD_251_Kirgo_Ready_To_Fight_Maybe_Later","AI_AddChoice",""
"Content/Story/Missions/DIA_GRD_251_Kirgo.d:164","Jestem gotowy do walki.","Pojďme bojovat.","","False","DIA_GRD_251_Kirgo_Hello_Why_Not.DIA_GRD_251_Kirgo_Hello.DIA_GRD_251_Kirgo_Ready_To_Fight_I_Am_Ready","AI_AddChoice",""
"Content/Story/Missions/DIA_GRD_251_Kirgo.d:236","Dobrze. Ja się nigdzie nie wybieram.","Jasně. Ještě tu chvíli zůstanu.","","False","Kirgo-CH0-G1RDemo_KirgoFight-Kirgo-41448","",""
"Content/Story/Missions/DIA_GRD_251_Kirgo.d:185","Czy to prawda, że w ogóle nie ma tu kobiet?","Je pravda, že tady nejsou žádné ženy? Vůbec žádné?","","False","Kirgo-CH0-None-Hero-24591","",""
"Content/Story/Missions/DIA_GRD_251_Kirgo.d:186","Są, ale tylko te sprowadzone przez Magnatów, by spełniały ich zachcianki. Uważaj, bo jeśli zawiesisz na którejś oko, Gomez każe cię wychłostać.","Jen pár, Rudobaroni se těší z jejich společnosti. Ale jestli se na ně jen podíváš, Gomez tě nechá zmrskat až na kost.","","False","Kirgo-CH0-None-Kirgo-12464","",""
"Content/Story/Missions/DIA_GRD_251_Kirgo.d:189","Krążą plotki o jakiejś parze, która uciekła i gdzieś się ukrywa, ale ja w to nie wierzę. Ludzie uwielbiają gadać... i chlać... a potem gadać jeszcze więcej.","Říká se, že se nějaký pár utekl a teď se někde skrývají, ale to je nesmysl. Lidi hodně mluví - a takyhodně pijou - a pak ještě víc mluví.","","False","Kirgo-CH0-None-Kirgo-85213","",""
"Content/Story/Missions/DIA_GRD_251_Kirgo.d:218","Może za chwilę.","Možná později.","","False","DIA_GRD_251_Kirgo_Ready_To_Fight_Info.DIA_GRD_251_Kirgo_Ready_To_Fight.DIA_GRD_251_Kirgo_Ready_To_Fight_Maybe_Later","AI_AddChoice",""
"Content/Story/Missions/DIA_GRD_251_Kirgo.d:225","Jestem gotowy do walki.","Pojďme bojovat.","","False","DIA_GRD_251_Kirgo_Ready_To_Fight_Info.DIA_GRD_251_Kirgo_Ready_To_Fight.DIA_GRD_251_Kirgo_Ready_To_Fight_I_Am_Ready","AI_AddChoice",""
"Content/Story/Missions/DIA_GRD_251_Kirgo.d:279","Jestem gotowy do walki.","Pojďme bojovat.","","False","Kirgo-CH0-G1RDemo_KirgoFight-Hero-64994","",""
"Content/Story/Missions/DIA_GRD_251_Kirgo.d:300","Czekaj, tak bez broni? Załatw sobie jakąś. Bez tego to jak szczać pod wiatr.","Bojovat, beze zbraně? Nějakou si nejdřív najdi, jinak to nebude žádná zábava.","","False","Kirgo-CH0-G1RDemo_KirgoFight-Kirgo-39679","",""
"Content/Story/Missions/DIA_GRD_251_Kirgo.d:330","Oj, jak boli... tego się nie spodziewałem. Niezły jesteś... masz potencjał. Ale i tak mogę cię nauczyć paru sztuczek. Zainteresowany?","Au... to jsem teda nečekal. Nebyl to špatný... máš potenciál. Stejně ti ale můžu ukázat nějaké triky. Zajímá tě to?","","False","Kirgo-CH0-G1RDemo_KirgoFight-Kirgo-87315","",""
"Content/Story/Missions/DIA_GRD_251_Kirgo.d:336","To była dobra walka! Nic ci nie złamałem?","Dobrý souboj! Doufám, že jsem ti nic nezlomil.","","False","Kirgo-CH0-G1RDemo_KirgoFight-Kirgo-35355","",""
"Content/Story/Missions/DIA_GRD_251_Kirgo.d:337","... Chyba przeżyję.","...všechno v pořádku.","","False","Kirgo-CH0-G1RDemo_KirgoFight-Hero-61657","",""
"Content/Story/Missions/DIA_GRD_251_Kirgo.d:340","To dobrze. Nie walczysz źle, kolego. Musisz trochę poćwiczyć, ale masz potencjał. Chcesz, żebym nauczył cię paru sztuczek?","To jsem rád. Nebylo to špatné, kamaráde. potřebuješ trošku tréninku, ale máš poteniciál. Cheš ukázat nějaké triky?","","False","Kirgo-CH0-G1RDemo_KirgoFight-Kirgo-59331","",""
"Content/Story/Missions/DIA_GRD_251_Kirgo.d:341","Pewnie, czemu nie.","Jistě, proč ne.","","False","Kirgo-CH0-G1RDemo_KirgoFight-Hero-54063-0","",""
"Content/Story/Missions/DIA_GRD_251_Kirgo.d:342","No dobra. Po pierwsze, gdy posługujesz się taką bronią, trzymaj ją jedną ręką, a nie obiema. Gdy nabierzesz nieco mięśni, będziesz znacznie zwinniejszy, co pozwoli ci płynnie łączyć ataki.","Dobrá. První věc, když používáš zbraň jako tuhle, drž ji v jedné ruce, ne ve dvou. Jakmile trošku zesílíě, budeš mnohem obratnější a budeš schopen zasadit několik úderů po sobě.","","False","Kirgo-CH0-G1RDemo_KirgoFight-Kirgo-565-0","",""
"Content/Story/Missions/DIA_GRD_251_Kirgo.d:346","Po drugie, jeśli podczas wyprowadzania ataku zdasz sobie sprawę, że odsłoni cię to na ripostę przeciwnika, wycofaj się i wykonaj unik. Wymaga to nieco treningu, ale poradzisz sobie.","Za druhé, když si všimneš, že se chystá protivník provést protiútok, uskoč dozadu a vyhni se mu. Vyžaduje to trošku cviku, ale ty to zvládneš.","","False","Kirgo-CH0-G1RDemo_KirgoFight-Kirgo-95345-0","",""
"Content/Story/Missions/DIA_GRD_251_Kirgo.d:352","Pamiętaj też, aby podczas parowania wyczuć idealny moment. Po idealnej paradzie twój przeciwnik będzie podatny na atak.","A nakonec, když se budeš krýt, zkus to udělat na poslední chvíli. Perfektní vykrytí protivníka zaskočí.","","False","Kirgo-CH0-G1RDemo_KirgoFight-Kirgo-10101","",""
"Content/Story/Missions/DIA_GRD_251_Kirgo.d:353","Rozumiem. Dzięki.","Dobře, chápu. Díky.","","False","Kirgo-CH0-G1RDemo_KirgoFight-Hero-55473","",""
"Content/Story/Missions/DIA_GRD_251_Kirgo.d:357","Pamiętaj również, żeby parować w idealnym momencie. Dzięki temu wybijesz wroga z równowagi i będziesz mógł zaatakować.","A nakonec, když se budeš krýt, zkus to udělat na poslední chvíli. Perfektní vykrytí protivníka zaskočí.","","False","Kirgo-CH0-G1RDemo_KirgoFight-Kirgo-35698","",""
"Content/Story/Missions/DIA_GRD_251_Kirgo.d:364","Rozumiem. Dzięki.","Dobře, chápu. Díky.","","False","Kirgo-CH0-G1RDemo_KirgoFight-Hero-55473-0","",""
"Content/Story/Missions/DIA_GRD_251_Kirgo.d:367","Do usług. Lepiej znajdź sobie jakieś obozowisko. Zaczyna się ściemniać.","Nemáš zač. Ale teď by ses měl vážně postarat o to místo na spaní. Brzy se setmí.","","False","Kirgo-CH0-G1RDemo_KirgoFight-Kirgo-83210","",""
"Content/Story/Missions/DIA_GRD_251_Kirgo.d:375","Do usług. Lepiej znajdź sobie jakieś obozowisko. Zaczyna się ściemniać.","Nemáš zač. Ale teď by ses měl vážně postarat o to místo na spaní. Brzy se setmí.","","False","Kirgo-CH0-G1RDemo_KirgoFight-Kirgo-83210-0","",""
"Content/Story/Missions/DIA_GRD_251_Kirgo.d:396","Właściwie to dlaczego jesteś taki przyjazny?","Proč jsi vlastně tak... přátelský?","","False","DIA_GRD_251_Kirgo_Why_Are_You_Nice.description","",""
"Content/Story/Missions/DIA_GRD_251_Kirgo.d:399","Właściwie to dlaczego jesteś taki przyjazny?","Proč jsi vlastně tak... přátelský?","","False","Kirgo-CH0-G1RDemo_KirgoFight-Hero-21333","",""
"Content/Story/Missions/DIA_GRD_251_Kirgo.d:399","Mówisz, jakby było w tym coś złego. Sam nie wiem. Może dlatego, że pozostali tutaj wyglądają, jakby nie srali od lat, więc próbuję to jakoś zrównoważyć.","Říkáš to, jako by to bylo něco špatného. Nemám ponětí, člověče. Možná proto, že polovina lidí tady vypadá, jako by se už deset let nemohli vysrat.","","False","Kirgo-CH0-G1RDemo_KirgoFight-Kirgo-42430-0","",""
"Content/Story/Missions/DIA_GRD_251_Kirgo.d:427","Co powiesz na rewanż?","Co takhle odveta?","","False","DIA_GRD_251_Kirgo_About_Rematch.description","",""
"Content/Story/Missions/DIA_GRD_251_Kirgo.d:435","Co powiesz na rewanż?","Co takhle odveta?","","False","Kirgo-CH0-G1RDemo_KirgoFight-Hero-57048","",""
"Content/Story/Missions/DIA_GRD_251_Kirgo.d:436","Tak szybko? Pewnie. Powiedz kiedy.","Cože, hned teď? Jasně, stačí říct.","","False","Kirgo-CH0-G1RDemo_KirgoFight-Kirgo-48441","",""
"Content/Story/Missions/DIA_GRD_251_Kirgo.d:440","Daj mi chwilę.","Dej mi chvilku.","","False","DIA_GRD_251_Kirgo_About_Rematch_Info.DIA_GRD_251_Kirgo_About_Rematch.DIA_GRD_251_Kirgo_About_Rematch_Wait","AI_AddChoice",""
"Content/Story/Missions/DIA_GRD_251_Kirgo.d:442","Tym razem się nie powstrzymuj. Daj z siebie wszystko.","Nešetři mě, ukaž, co v tobě je!","","False","DIA_GRD_251_Kirgo_About_Rematch_Info.DIA_GRD_251_Kirgo_About_Rematch.DIA_GRD_251_Kirgo_About_Rematch_No_Mercy","AI_AddChoice",""
"Content/Story/Missions/DIA_GRD_251_Kirgo.d:451","Walczmy.","Bojujme.","","False","DIA_GRD_251_Kirgo_About_Rematch_Info.DIA_GRD_251_Kirgo_About_Rematch.DIA_GRD_251_Kirgo_About_Rematch_Fight","AI_AddChoice",""
"Content/Story/Missions/DIA_GRD_251_Kirgo.d:454","Hm, czemu nie. Tylko najpierw skombinuj sobie jakąś broń.","Hmm, proč ne, ale nejdřív si najdi zbraň.","","False","Kirgo-CH0-G1RDemo_KirgoFight-Kirgo-70786","",""
"Content/Story/Missions/DIA_GRD_251_Kirgo.d:464","Walczmy.","Bojujme.","","False","Kirgo-CH0-G1RDemo_KirgoFight-Hero-23822","",""
"Content/Story/Missions/DIA_GRD_251_Kirgo.d:464","Dobrze. Pokaż, co potrafisz!","Dobře. Ukaž, co umíš!","","False","Kirgo-CH0-G1RDemo_KirgoFight-Kirgo-18035","",""
"Content/Story/Missions/DIA_GRD_251_Kirgo.d:473","Tym razem się nie powstrzymuj. Daj z siebie wszystko.","Nešetři mě, ukaž, co v tobě je!","","False","Kirgo-CH0-G1RDemo_KirgoFight-Hero-92998","",""
"Content/Story/Missions/DIA_GRD_251_Kirgo.d:474","Jesteś pewny? No dobrze, zatańczmy.","Jseš si jistej? Dobrá, tak pojďme!","","False","Kirgo-CH0-G1RDemo_KirgoFight-Kirgo-72913","",""
"Content/Story/Missions/DIA_GRD_251_Kirgo.d:483","Daj mi chwilę.","Dej mi chvilku.","","False","Kirgo-CH0-G1RDemo_KirgoFight-Hero-17711","",""
"Content/Story/Missions/DIA_GRD_251_Kirgo.d:487","Dobrze. Wiesz, gdzie mnie szukać.","Dobrá. Víš, kde mě najdeš.","","False","Kirgo-CH0-G1RDemo_KirgoFight-Kirgo-27576","",""
"Content/Story/Missions/DIA_GRD_251_Kirgo.d:520","Nieźle... Tego się nie spodziewałem.","To není špatné... to jsem nečekal.","","False","Kirgo-CH0-None-Kirgo-65501","",""
"Content/Story/Missions/DIA_GRD_251_Kirgo.d:522","Dobra walka. Idzie ci coraz lepiej!","Dobrý souboj. Zlepšuješ se!","","False","Kirgo-CH0-None-Kirgo-22502","",""
"Content/Story/Missions/DIA_GRD_251_Kirgo.d:522","Muszę wracać do roboty. Do zobaczenia.","Každopádně, musím se vrátit k práci. Ještě se uvidíme!","","False","Kirgo-CH0-None-Kirgo-30285-0","",""
