"location","source","target","id","fuzzy","context","translator_comments","developer_comments"
"Content/Story/Missions/DIA_ORG_819_Drax.d:33","Chwileczkę. To ciebie właśnie do nas wrzucili, prawda? Nie musisz nic mówić, już wiem.","","","","Drax-CH0-G1RDemo_DraxHunt-Drax-89011","",""
"Content/Story/Missions/DIA_ORG_819_Drax.d:34","Masz wypisane na gębie pytanie: „W co ja się, kurwa, wpakowałem?”","","","","Drax-CH0-G1RDemo_DraxHunt-Drax-20861","",""
"Content/Story/Missions/DIA_ORG_819_Drax.d:35","Pewnie już wiesz, że tu utknęliśmy?","","","","Drax-CH0-G1RDemo_DraxHunt-Drax-10911","",""
"Content/Story/Missions/DIA_ORG_819_Drax.d:40","Tak, jestem tu nowy, ale przysyła mnie twój kumpel, Ratford.","","","","Drax-CH0-G1RDemo_DraxHunt-Hero-9657","",""
"Content/Story/Missions/DIA_ORG_819_Drax.d:41","Powiedział, że mogę u was przenocować, ale kazał pomóc w polowaniu.","","","","Drax-CH0-G1RDemo_DraxHunt-Hero-46836","",""
"Content/Story/Missions/DIA_ORG_819_Drax.d:42","Rat? I co? Znalazł Jorika?","","","","Drax-CH0-G1RDemo_DraxHunt-Drax-58516","",""
"Content/Story/Missions/DIA_ORG_819_Drax.d:43","Tak, nie żyje.","","","","Drax-CH0-G1RDemo_DraxHunt-Hero-8890","",""
"Content/Story/Missions/DIA_ORG_819_Drax.d:44","Rozumiem. Szkoda, ale jakoś mnie to nie dziwi.","","","","Drax-CH0-G1RDemo_DraxHunt-Drax-97866","",""
"Content/Story/Missions/DIA_ORG_819_Drax.d:45","Czyli chcesz mi pomóc w polowaniu... Miło z twojej strony. Dobra, czemu nie. Do dzieła.","","","","Drax-CH0-G1RDemo_DraxHunt-Drax-26302","",""
"Content/Story/Missions/DIA_ORG_819_Drax.d:53","Tak, szukam bezpiecznego miejsca na nocleg. Podobno łazi tu jakiś cieniostwór.","","","","Drax-CH0-G1RDemo_DraxHunt-Hero-43176","",""
"Content/Story/Missions/DIA_ORG_819_Drax.d:54","To prawda. Też go widzieliśmy. Wielki skurwysyn.","","","","Drax-CH0-G1RDemo_DraxHunt-Drax-70619","",""
"Content/Story/Missions/DIA_ORG_819_Drax.d:55","Co powiesz na układ? Pomożesz mi upolować to stado ścierwojadów, a my podzielimy się z tobą jadłem i będziesz mógł się przespać przy naszym ognisku.","","","","Drax-CH0-G1RDemo_DraxHunt-Drax-49351","",""
"Content/Story/Missions/DIA_ORG_819_Drax.d:56","Jest w starym obozie górniczym naprzeciwko zalanej kopalni. Nieźle osłonięte miejsce. Co ty na to?","","","","Drax-CH0-G1RDemo_DraxHunt-Drax-43533","",""
"Content/Story/Missions/DIA_ORG_819_Drax.d:58","Nie jestem zainteresowany.","Мені це не цікаво.","","False","DIA_ORG_819_Drax_Hello_Info.DIA_ORG_819_Drax_Hello.DIA_ORG_819_Drax_Hello_No","AI_AddChoice",""
"Content/Story/Missions/DIA_ORG_819_Drax.d:59","A ty co z tego masz? Spokojnie dałbyś radę tym ścierwojadom w pojedynkę.","","","","DIA_ORG_819_Drax_Hello_Info.DIA_ORG_819_Drax_Hello.DIA_ORG_819_Drax_Hello_You_Could_Do_It_Yourself","AI_AddChoice",""
"Content/Story/Missions/DIA_ORG_819_Drax.d:60","Skąd mam wiedzieć, że to nie pułapka?","","","","DIA_ORG_819_Drax_Hello_Info.DIA_ORG_819_Drax_Hello.DIA_ORG_819_Drax_Hello_Maybe_Its_A_Trap","AI_AddChoice",""
"Content/Story/Missions/DIA_ORG_819_Drax.d:61","Nie brzmisz, jakbyś był z Khorinis.","","","","DIA_ORG_819_Drax_Hello_Info.DIA_ORG_819_Drax_Hello.DIA_ORG_819_Drax_Hello_You_Are_Not_From_Khorinis","AI_AddChoice",""
"Content/Story/Missions/DIA_ORG_819_Drax.d:62","„Naszym” ognisku?","","","","DIA_ORG_819_Drax_Hello_Info.DIA_ORG_819_Drax_Hello.DIA_ORG_819_Drax_Hello_About_Fire","AI_AddChoice",""
"Content/Story/Missions/DIA_ORG_819_Drax.d:72","„Naszym” ognisku?","","","","Drax-CH0-G1RDemo_DraxHunt-Hero-47782","",""
"Content/Story/Missions/DIA_ORG_819_Drax.d:73","Taa, jest moje i moich ziomków.","","","","Drax-CH0-G1RDemo_DraxHunt-Drax-87244","",""
"Content/Story/Missions/DIA_ORG_819_Drax.d:83","Nie brzmisz, jakbyś był z Khorinis.","","","","Drax-CH0-None-Hero-72487","",""
"Content/Story/Missions/DIA_ORG_819_Drax.d:85","Ty też nie.","","","","Drax-CH0-None-Drax-86382","",""
"Content/Story/Missions/DIA_ORG_819_Drax.d:85","To skąd jesteś? Krainy Centralne?","","","","Drax-CH0-None-Hero-57725","",""
"Content/Story/Missions/DIA_ORG_819_Drax.d:89","Może tak, może nie.","","","","Drax-CH0-None-Drax-47752","",""
"Content/Story/Missions/DIA_ORG_819_Drax.d:94","Skąd mam wiedzieć, że to nie pułapka?","","","","Drax-CH0-G1RDemo_DraxHunt-Hero-80576","",""
"Content/Story/Missions/DIA_ORG_819_Drax.d:95","A wyglądam ci na złego złoczyńcę, który chce ograbić biedną świeżynkę z całego nieistniejącego dobytku?","","","","Drax-CH0-G1RDemo_DraxHunt-Drax-27434","",""
"Content/Story/Missions/DIA_ORG_819_Drax.d:96","Bez urazy, przyjacielu, ale gdybym miał z tobą problem, już byś nie żył.","","","","Drax-CH0-G1RDemo_DraxHunt-Drax-91704","",""
"Content/Story/Missions/DIA_ORG_819_Drax.d:102","A ty co z tego masz? Spokojnie dałbyś radę tym ścierwojadom w pojedynkę.","","","","Drax-CH0-G1RDemo_DraxHunt-Hero-61662-0","",""
"Content/Story/Missions/DIA_ORG_819_Drax.d:103","Aleś ty ostrożny. To dobrze! Po pierwsze: pamiętam, jak sam zostałem tu wrzucony i wszyscy próbowali mnie orżnąć albo zabić.","","","","Drax-CH0-G1RDemo_DraxHunt-Drax-66721","",""
"Content/Story/Missions/DIA_ORG_819_Drax.d:104","Po drugie: jeśli się okaże, że jesteś choć ODROBINĘ mniej bezużyteczny niż przeciętna świeżynka, mogę ci doradzić, żebyś olał to, co pewnie nagadał ci Diego, i spróbował dołączyć do NASZEGO obozu – Nowego Obozu.","","","","Drax-CH0-G1RDemo_DraxHunt-Drax-59742","",""
"Content/Story/Missions/DIA_ORG_819_Drax.d:107","Przynajmniej z nami nie będziesz musiał do końca życia włazić w dupę Gomezowi.","","","","Drax-CH0-G1RDemo_DraxHunt-Drax-43603","",""
"Content/Story/Missions/DIA_ORG_819_Drax.d:109","Nie jestem zainteresowany.","Мені це не цікаво.","","False","DIA_ORG_819_Drax_Hello_You_Could_Do_It_Yourself.DIA_ORG_819_Drax_Hello.DIA_ORG_819_Drax_Hello_No","AI_AddChoice",""
"Content/Story/Missions/DIA_ORG_819_Drax.d:110","Umowa stoi. Jaki jest plan?","","","","DIA_ORG_819_Drax_Hello_You_Could_Do_It_Yourself.DIA_ORG_819_Drax_Hello.DIA_ORG_819_Drax_Hello_About_Plan","AI_AddChoice",""
"Content/Story/Missions/DIA_ORG_819_Drax.d:114","A ten wasz gang ma przywódcę?","","","","DIA_ORG_819_Drax_Hello_You_Could_Do_It_Yourself.DIA_ORG_819_Drax_Hello.DIA_ORG_819_Drax_Hello_About_Leader","AI_AddChoice",""
"Content/Story/Missions/DIA_ORG_819_Drax.d:117","Skąd mam wiedzieć, że to nie pułapka?","","","","DIA_ORG_819_Drax_Hello_You_Could_Do_It_Yourself.DIA_ORG_819_Drax_Hello.DIA_ORG_819_Drax_Hello_Maybe_Its_A_Trap","AI_AddChoice",""
"Content/Story/Missions/DIA_ORG_819_Drax.d:122","Nie brzmisz, jakbyś był z Khorinis.","","","","DIA_ORG_819_Drax_Hello_You_Could_Do_It_Yourself.DIA_ORG_819_Drax_Hello.DIA_ORG_819_Drax_Hello_You_Are_Not_From_Khorinis","AI_AddChoice",""
"Content/Story/Missions/DIA_ORG_819_Drax.d:129","„Naszym” ognisku?","","","","DIA_ORG_819_Drax_Hello_You_Could_Do_It_Yourself.DIA_ORG_819_Drax_Hello.DIA_ORG_819_Drax_Hello_About_Fire","AI_AddChoice",""
"Content/Story/Missions/DIA_ORG_819_Drax.d:132","A ten wasz gang ma przywódcę?","","","","TEXT_DAVID_20230811_170556_41","",""
"Content/Story/Missions/DIA_ORG_819_Drax.d:132","Ma – Laresa. Ale powtarzam: to nie jest taki układ jak w Starym Obozie. Dowodzi, bo najlepiej nadaje się do tej roboty, i tyle. Kiedy to się zmieni, ustąpi miejsca komuś lepszemu.","","","","TEXT_DAVID_20230811_170615","",""
"Content/Story/Missions/DIA_ORG_819_Drax.d:143","Umowa stoi. Jaki jest plan?","","","","Drax-CH0-G1RDemo_DraxHunt-Hero-66022","",""
"Content/Story/Missions/DIA_ORG_819_Drax.d:144","Nie potrzebujemy planu. Te ptaszyska są głupie jak but, więc po prostu wpadasz i je zabijasz.","","","","TEXT_DAVID_20230811_170008","",""
"Content/Story/Missions/DIA_ORG_819_Drax.d:148","Tylko nie daj się otoczyć. Daj znać, jak będziesz gotowy. Wtedy wyruszymy.","","","","TEXT_DAVID_20230811_170018","",""
"Content/Story/Missions/DIA_ORG_819_Drax.d:153","Nie jestem zainteresowany.","Мені це не цікаво.","","False","Drax-CH0-G1RDemo_DraxHunt-Hero-34325","",""
"Content/Story/Missions/DIA_ORG_819_Drax.d:153","Nie przepadasz za towarzystwem, co? Głupie podejście, ale jak sobie chcesz. Tylko trzymaj się z daleka od moich ścierwojadów, bo mogę cię z którymś pomylić.","","","","Drax-CH0-G1RDemo_DraxHunt-Drax-97644-2","",""
"Content/Story/Missions/DIA_ORG_819_Drax.d:179","Zapolujmy.","","","","DIA_ORG_819_Drax_Lets_Hunt.description","",""
"Content/Story/Missions/DIA_ORG_819_Drax.d:184","Zapolujmy.","","","","Drax-CH0-G1RDemo_DraxHunt-Hero-36233","",""
"Content/Story/Missions/DIA_ORG_819_Drax.d:186","I to właśnie chciałem usłyszeć. Broń masz?","","","","Drax-CH0-None-Drax-27879","",""
"Content/Story/Missions/DIA_ORG_819_Drax.d:193","Tak.","Так.","","False","Drax-CH0-None-Hero-90162","",""
"Content/Story/Missions/DIA_ORG_819_Drax.d:194","Dobrze. No to chodź za mną.","","","","Drax-CH0-None-Drax-91362","",""
"Content/Story/Missions/DIA_ORG_819_Drax.d:196","Nie.","Ні.","","False","Drax-CH0-None-Hero-54250","",""
"Content/Story/Missions/DIA_ORG_819_Drax.d:202","Jaja sobie robisz? To weź jakąś znajdź. Mogę zaczekać jeszcze parę minut.","","","","Drax-CH0-None-Drax-3588-0","",""
"Content/Story/Missions/DIA_ORG_819_Drax.d:224","Może za chwilę.","","","","DIA_ORG_819_Drax_Hunting_Maybe_Later.description","",""
"Content/Story/Missions/DIA_ORG_819_Drax.d:232","Może za chwilę.","","","","Kirgo-CH0-G1RDemo_KirgoFight-Hero-79373","",""
"Content/Story/Missions/DIA_ORG_819_Drax.d:236","Dobrze, mogę chwilę poczekać.","","","","Drax-CH0-None-Drax-3588-1","",""
"Content/Story/Missions/DIA_ORG_819_Drax.d:291","Zapomnij o ścierwojadach.","","","","Drax-CH0-G1RDemo_DraxHunt-Drax-50312","",""
"Content/Story/Missions/DIA_ORG_819_Drax.d:292","Dlaczego?","Навіщо?","","False","Drax-CH0-G1RDemo_DraxHunt-Hero-62484","",""
"Content/Story/Missions/DIA_ORG_819_Drax.d:292","Bo ktoś je ukatrupił, kiedy nie patrzyłem. Jestem PEWIEN, że to nie byłeś ty.","","","","Drax-CH0-G1RDemo_DraxHunt-Drax-43473","",""
"Content/Story/Missions/DIA_ORG_819_Drax.d:294","Dobra, chuj z tym. Wracam do obozu. Na kolację będzie suszone mięso...","","","","Drax-CH0-G1RDemo_DraxHunt-Drax-95185","",""
"Content/Story/Missions/DIA_ORG_819_Drax.d:280","Chodźmy.","","","","Drax-CH0-G1RDemo_DraxHunt-Drax-78430","",""
"Content/Story/Missions/DIA_ORG_819_Drax.d:280","Ha! Niezła zdobycz.","","","","Drax-CH0-G1RDemo_DraxHunt-Drax-18631","",""
"Content/Story/Missions/DIA_ORG_819_Drax.d:283","Miałem zamiar wypatroszyć je tutaj, ale skoro Rat jest już w obozie, nie traćmy więcej czasu. Spotkamy się na miejscu, młody! Dobra robota.","","","","Drax-CH0-G1RDemo_DraxHunt-Drax-16681","",""
"Content/Story/Missions/DIA_ORG_819_Drax.d:295","Ale co z naszą umową? Ciągle potrzebuję noclegu.","","","","Drax-CH0-G1RDemo_DraxHunt-Hero-1376","",""
"Content/Story/Missions/DIA_ORG_819_Drax.d:297","Taa... Współczuję, naprawdę. Niestety, nic w życiu nie ma za darmo.","","","","Drax-CH0-G1RDemo_DraxHunt-Drax-70710","",""
"Content/Story/Missions/DIA_ORG_819_Drax.d:306","Rozejrzyj się po okolicy. Na pewno sobie coś znajdziesz.","","","","Drax-CH0-G1RDemo_DraxHunt-Drax-40881","",""
"Content/Story/Missions/DIA_ORG_819_Drax.d:311","Nie jesteś z tych, którzy lubią planować, co? Nieważne. Mamy skubańce. Wiesz, jak się je patroszy?","","","","Drax-CH0-G1RDemo_FindJorik-Drax-80360","",""
"Content/Story/Missions/DIA_ORG_819_Drax.d:314","Dobra robota! Nawet niezła ta zdobycz. Słuchaj, wiesz, jak się je patroszy?","","","","Drax-CH0-G1RDemo_FindJorik-Drax-55131","",""
"Content/Story/Missions/DIA_ORG_819_Drax.d:314","Eee, no cóż...","","","","Drax-CH0-G1RDemo_FindJorik-Hero-55641-0","",""
"Content/Story/Missions/DIA_ORG_819_Drax.d:315","Nieważne, poradzę sobie. Skoro już tu jesteś, to może mógłbyś znaleźć mojego druha Ratforda i sprawdzić, czy nie potrzebuje pomocy.","","","","Drax-CH0-G1RDemo_FindJorik-Drax-59799-0","",""
"Content/Story/Missions/DIA_ORG_819_Drax.d:317","Jeden z członków naszej kompanii, Jorik, zaginął. Sądzimy, że może być gdzieś w kanionie. Rat właśnie go szuka. Do zobaczenia przy ognisku.","","","","Drax-CH0-G1RDemo_FindJorik-Drax-21285-0","",""
"Content/Story/Missions/DIA_ORG_819_Drax.d:319","Jak wygląda ten cały Ratford?","","","","DIA_ORG_819_Drax_After_Hunting_Info.DIA_ORG_819_Drax_After_Hunting.DIA_ORG_819_Drax_Hello_About_Ratford","AI_AddChoice",""
"Content/Story/Missions/DIA_ORG_819_Drax.d:320","Co się stało z tym Jorikiem?","","","","DIA_ORG_819_Drax_After_Hunting_Info.DIA_ORG_819_Drax_After_Hunting.DIA_ORG_819_Drax_After_Hunting_About_Jorik","AI_AddChoice",""
"Content/Story/Missions/DIA_ORG_819_Drax.d:323","Twój gang pewnie dowodzi tym Nowym Obozem, o którym wspominałeś?","","","","DIA_ORG_819_Drax_After_Hunting_Info.DIA_ORG_819_Drax_After_Hunting.DIA_ORG_819_Drax_After_Hunting_About_Crew","AI_AddChoice",""
"Content/Story/Missions/DIA_ORG_819_Drax.d:326","„Kompanii”?","","","","DIA_ORG_819_Drax_After_Hunting_Info.DIA_ORG_819_Drax_After_Hunting.DIA_ORG_819_Drax_Hello_About_Company","AI_AddChoice",""
"Content/Story/Missions/DIA_ORG_819_Drax.d:334","Przykro mi, przyjacielu, ale dokonałeś wyboru. Powodzenia.","","","","Drax-CH0-G1RDemo_DraxHunt-Drax-57366","",""
"Content/Story/Missions/DIA_ORG_819_Drax.d:338","„Kompanii”?","","","","Drax-CH0-G1RDemo_FindJorik-Hero-91969-0","",""
"Content/Story/Missions/DIA_ORG_819_Drax.d:340","Tak, naszego gangu. Czerwoni nazywają nas bandytami, ale to niesprawiedliwa opinia. Jesteśmy czymś więcej.","","","","Drax-CH0-G1RDemo_FindJorik-Drax-9536-0","",""
"Content/Story/Missions/DIA_ORG_819_Drax.d:341","Twój gang pewnie dowodzi tym Nowym Obozem, o którym wspominałeś?","","","","Drax-CH0-G1RDemo_FindJorik-Hero-86916-0","",""
"Content/Story/Missions/DIA_ORG_819_Drax.d:342","„Dowodzi” to nie jest właściwe słowo. Jasne, mamy swoje kliki i tak dalej, ale nie ma ustalonych zasad czy sztywnej, jak to się mówi, hierarchii.","","","","Drax-CH0-G1RDemo_FindJorik-Drax-45745-0","",""
"Content/Story/Missions/DIA_ORG_819_Drax.d:349","Ale pogadamy o tym, kiedy już nabiję tego ścierwojada na ruszt i upiekę go na wolnym ogniu.","","","","Drax-CH0-G1RDemo_FindJorik-Drax-77367-0","",""
"Content/Story/Missions/DIA_ORG_819_Drax.d:350","Co się stało z tym Jorikiem?","","","","Drax-CH0-G1RDemo_FindJorik-Hero-96179-0","",""
"Content/Story/Missions/DIA_ORG_819_Drax.d:354","Tego właśnie chcemy się dowiedzieć. Facet po prostu wziął, gdzieś poszedł i tyleśmy go widzieli.","","","","Drax-CH0-G1RDemo_FindJorik-Drax-63260-0","",""
"Content/Story/Missions/DIA_ORG_819_Drax.d:357","Ktoś widział, jak się wspinał po zboczach kanionu w okolicy, ale nic poza tym.","","","","Drax-CH0-G1RDemo_FindJorik-Drax-56611-0","",""
"Content/Story/Missions/DIA_ORG_819_Drax.d:358","Jak wygląda ten cały Ratford?","","","","Drax-CH0-G1RDemo_FindJorik-Hero-29676-0","",""
"Content/Story/Missions/DIA_ORG_819_Drax.d:360","Mojej postury, czarne włosy, krzaczaste wąsy. Nosi taki sam pancerz jak ja, więc powinno go być łatwo wypatrzyć.","","","","Drax-CH0-G1RDemo_FindJorik-Drax-46680-2","",""
"Content/Story/Missions/DIA_ORG_819_Drax.d:366","Znajdź Jorika i wróćcie tutaj. Do tego czasu rozpalę ogień i przygotuję kolację. A tak przy okazji... Jestem Drax.","","","","Drax-CH0-G1RDemo_FindJorik-Drax-94407-0","",""
