"location","source","target","id","fuzzy","context","translator_comments","developer_comments"
"Content/Story/Missions/DIA_GRD_251_Kirgo.d:27","Proszę, proszę. Nowa twarz. Dopiero co cię wrzucili?","新米じゃないか。ここに放り込まれたばかりか？","","","Kirgo-CH0-None-Kirgo-13159","",""
"Content/Story/Missions/DIA_GRD_251_Kirgo.d:29","Nie twój interes.","あんたには関係ない。","","False","DIA_GRD_251_Kirgo_Hello_Info.DIA_GRD_251_Kirgo_Hello.DIA_GRD_251_Kirgo_Hello_Not_Your_Business","AI_AddChoice",""
"Content/Story/Missions/DIA_GRD_251_Kirgo.d:30","Tak.","そうだ。","","False","DIA_GRD_251_Kirgo_Hello_Info.DIA_GRD_251_Kirgo_Hello.DIA_GRD_251_Kirgo_Hello_Yes","AI_AddChoice",""
"Content/Story/Missions/DIA_GRD_251_Kirgo.d:37","Tak.","そうだ。","","","Kirgo-CH0-None-Hero-61590","",""
"Content/Story/Missions/DIA_GRD_251_Kirgo.d:38","No to witaj w Kolonii. Jak ci na imię? Mnie nazywają Kirgo.","ならコロニーへようこそ。名前は？俺はキルゴだ。","","","Kirgo-CH0-None-Kirgo-72322","",""
"Content/Story/Missions/DIA_GRD_251_Kirgo.d:39","Nyras.","ナイラスだ。","","","Kirgo-CH0-None-Hero-54970","",""
"Content/Story/Missions/DIA_GRD_251_Kirgo.d:40","Miło poznać. Może chwilę porozmawiamy? Powiedz mi, jak się sprawy mają na zewnątrz, a ja zdradzę ci parę rzeczy, które ułatwią ci przeżycie w tej dziurze.","会えて光栄だ。少し話す時間はあるか？外の最新情報を教えてくれたら、ここで生き残る方法を教えてやるよ。 ","","","Kirgo-CH0-None-Kirgo-53995","",""
"Content/Story/Missions/DIA_GRD_251_Kirgo.d:41","Cały dzień przerzucam ten cholerny gruz. Chciałbym się na chwilę od tego oderwać... To jak, pogadamy?","一日中岩を移動してたもんでな、少し気晴らしが必要だ。どうだ？","","","Kirgo-CH0-None-Kirgo-48505","",""
"Content/Story/Missions/DIA_GRD_251_Kirgo.d:47","Nie mam na to czasu.","こんなことしてる暇はない。","","False","DIA_GRD_251_Kirgo_Hello_Yes.DIA_GRD_251_Kirgo_Hello.DIA_GRD_251_Kirgo_Hello_No_Time","AI_AddChoice",""
"Content/Story/Missions/DIA_GRD_251_Kirgo.d:48","No trudno.","わかった。","","False","DIA_GRD_251_Kirgo_Hello_Yes.DIA_GRD_251_Kirgo_Hello.DIA_GRD_251_Kirgo_Hello_Too_Bad","AI_AddChoice",""
"Content/Story/Missions/DIA_GRD_251_Kirgo.d:49","A może opowiem ci w zamian za bezpieczny nocleg?","","","","DIA_GRD_251_Kirgo_Hello_Yes.DIA_GRD_251_Kirgo_Hello.DIA_GRD_251_Kirgo_Hello_Story_For_A_Place_To_Sleep","AI_AddChoice",""
"Content/Story/Missions/DIA_GRD_251_Kirgo.d:50","Dlaczego w ogóle obchodzi cię, co się dzieje na zewnątrz?","","","","DIA_GRD_251_Kirgo_Hello_Yes.DIA_GRD_251_Kirgo_Hello.DIA_GRD_251_Kirgo_Hello_Why_Are_You_Interested_In_This","AI_AddChoice",""
"Content/Story/Missions/DIA_GRD_251_Kirgo.d:56","Dlaczego w ogóle obchodzi cię, co się dzieje na zewnątrz? Przecież i tak się stąd nie wydostaniemy.","なんで外の世界が気になるんだ？出れないおとは知ってるだろ？","","","Kirgo-CH0-None-Hero-5576","",""
"Content/Story/Missions/DIA_GRD_251_Kirgo.d:57","Ludzie z Nowego Obozu i typy żyjące na bagnie twierdzą inaczej. Ale masz rację, pewnie spędzimy tu resztę życia.","ニュー・キャンプの連中と沼の奴らはそうは思ってないがな。でも、お前の言うとおりだ。 ","","","Kirgo-CH0-None-Kirgo-48595","",""
"Content/Story/Missions/DIA_GRD_251_Kirgo.d:58","Ja tam uważam, że warto sobie czasem przypomnieć, że świat nie kończy się na tej zasranej, niebieskiej kopule. Inaczej bym zwariował.","でも、世界はこの青いドームだけじゃないことをたまに再認識したいんだ。じゃなきゃおかしくなっちまう。","","","Kirgo-CH0-None-Kirgo-58994","",""
"Content/Story/Missions/DIA_GRD_251_Kirgo.d:64","A może ci opowiem w zamian za bezpieczny nocleg?","安全な寝場所と引き換えに教えるってのはどうだ？ ","","","Kirgo-CH0-None-Hero-57845","",""
"Content/Story/Missions/DIA_GRD_251_Kirgo.d:65","Może jedna z tych waszych chatek?","小屋の一つを借りちゃだめか？","","","Kirgo-CH0-None-Hero-75065","",""
"Content/Story/Missions/DIA_GRD_251_Kirgo.d:66","Boisz się cieniostwora, co? Pozwoliłbym ci, gdyby to zależało ode mnie, ale tak nie jest. Przykro mi.","シャドービーストがいるからか？小屋を貸してやってもいいんだが、俺だけの判断じゃないんだ。すまない。","","","Kirgo-CH0-None-Kirgo-5289","",""
"Content/Story/Missions/DIA_GRD_251_Kirgo.d:73","No trudno.","わかった。","","","Kirgo-CH0-None-Hero-75802-0","",""
"Content/Story/Missions/DIA_GRD_251_Kirgo.d:73","Szczerze, to nawet nie ma co tu dużo opowiadać. Każdy sra w gacie z powodu wojny, a wszystkie chore historie o orkach też nie pomagają.","正直そんなに言うことはない。戦争のせいでみんな警戒してる。オークに関する恐ろしい話も出回ってるからな。 ","","","Kirgo-CH0-None-Hero-49599-0","",""
"Content/Story/Missions/DIA_GRD_251_Kirgo.d:74","Krąży jednak plotka, że Nordmarczycy odnieśli kilka małych zwycięstw. I tyle.","ノードマリアンが小さい勝利を収めたって話はある。 ","","","Kirgo-CH0-None-Hero-7847","",""
"Content/Story/Missions/DIA_GRD_251_Kirgo.d:75","Chwała Innosowi. Miejmy nadzieję, że uda im się odzyskać część kopalń. Nie ma znaczenia, ilu więźniów wyśle tu król – na dłuższą metę nie ma szans, żebyśmy nadążyli za popytem.","イノッスの祝福を。鉱山のエリアもいくつか取り戻せることを願おう。王がどれだけ囚人をここに送り込んでも、間に合わないからな。","","","Kirgo-CH0-None-Kirgo-86946","",""
"Content/Story/Missions/DIA_GRD_251_Kirgo.d:76","A co z Khorinis? Miałeś szansę zobaczyć miasto, gdy cię tu przewozili?","コリニスの町は？移動中に見ることはできたか？","","","Kirgo-CH0-None-Kirgo-51889","",""
"Content/Story/Missions/DIA_GRD_251_Kirgo.d:78","Niestety nie. Przez cały czas byłem zamknięty.","いや。ずっと閉じ込められてたからな。","","","Kirgo-CH0-None-Hero-69630","",""
"Content/Story/Missions/DIA_GRD_251_Kirgo.d:78","Szkoda. Brakuje mi tego miasta. Mieszkałem tam przez kilka lat po opuszczeniu Varantu. Miałem nawet kobietę... Rosę.","それは残念だな。あの場所が恋しいよ…数年前、ヴァラントを去ったときに住んでたんだ。恋人もいた…ロサという女性だ。","","","Kirgo-CH0-None-Kirgo-15646","",""
"Content/Story/Missions/DIA_GRD_251_Kirgo.d:79","Nie wyobrażam sobie słodszej istoty. Była lepszym człowiekiem, niż ja kiedykolwiek będę.","優しくて、美しい心の持ち主だった。俺なんかよりもずっとな。  ","","","Kirgo-CH0-None-Kirgo-28860-0","",""
"Content/Story/Missions/DIA_GRD_251_Kirgo.d:82","Cholera, znowu zaczynam biadolić jak stary dziad. Wybacz.","ああ、まるでボケた老人のように喋りすぎたな。すまん。 ","","","Kirgo-CH0-None-Kirgo-50097","",""
"Content/Story/Missions/DIA_GRD_251_Kirgo.d:83","Czy to prawda, że w ogóle nie ma tu kobiet?","ここには女性がいないっていうのは本当か？","","False","DIA_GRD_251_Kirgo_Hello_Too_Bad.DIA_GRD_251_Kirgo_Hello.DIA_GRD_251_Kirgo_Hello_About_Women","AI_AddChoice",""
"Content/Story/Missions/DIA_GRD_251_Kirgo.d:87","Twoja kolej. Jakie masz dla mnie rady?","さあ、お前の番だ。アドバイスとは？","","False","DIA_GRD_251_Kirgo_Hello_Too_Bad.DIA_GRD_251_Kirgo_Hello.DIA_GRD_251_Kirgo_Hello_Any_Advice","AI_AddChoice",""
"Content/Story/Missions/DIA_GRD_251_Kirgo.d:93","Nie mam na to czasu.","こんなことしてる暇はない。","","","Kirgo-CH0-None-Hero-42421","",""
"Content/Story/Missions/DIA_GRD_251_Kirgo.d:98","Hm, szkoda. No ale jak wolisz.","ふむ。それは残念だ。引き止めたりはしないさ。","","","Kirgo-CH0-None-Kirgo-13085","",""
"Content/Story/Missions/DIA_GRD_251_Kirgo.d:104","Nie twój interes.","あんたには関係ない。","","","Kirgo-CH0-None-Hero-73711","",""
"Content/Story/Missions/DIA_GRD_251_Kirgo.d:104","Nie jesteś specjalnie rozmowny, co? Mnie to lata, ale radzę spuścić z tonu. Samotnicy szybko tu giną.","おしゃべりは苦手か？まあいいさ。でも口の利き方に気を付けるんだな。一匹狼はここでは生き残れないぞ。 ","","","Kirgo-CH0-None-Kirgo-8473","",""
"Content/Story/Missions/DIA_GRD_251_Kirgo.d:113","Twoja kolej. Jakie masz dla mnie rady?","さあ、お前の番だ。アドバイスとは？","","","Kirgo-CH0-G1RDemo_KirgoFight-Hero-99779","",""
"Content/Story/Missions/DIA_GRD_251_Kirgo.d:113","Dołącz do Starego Obozu. Jesteśmy sercem Kolonii. Wszystko, co wysyłają nam z zewnątrz, trafia do nas.","オールド・キャンプに入るんだな。俺たちはコロニーの要だ。外からの物資もまずは俺たちに届けられる。","","","Kirgo-CH0-G1RDemo_KirgoFight-Kirgo-70361","",""
"Content/Story/Missions/DIA_GRD_251_Kirgo.d:115","Chyba że osuną się skały...","崖崩れがなければな…","","","Kirgo-CH0-G1RDemo_KirgoFight-Hero-25026","",""
"Content/Story/Missions/DIA_GRD_251_Kirgo.d:115","Nie przejmuj się tym. Nasi chłopcy uporają się z tym w mgnieniu oka. Gomez jest surowy, ale wie, jak zarządzać tym miejscem.","それは気にするな。すぐに仲間が岩をどかすから。ゴメスは厳しいが、この場所の仕切り方はｗかってる。","","","Kirgo-CH0-G1RDemo_KirgoFight-Kirgo-58252","",""
"Content/Story/Missions/DIA_GRD_251_Kirgo.d:117","Gomez? To twój szef?","ゴメスがあんたのボスなのか？","","","Kirgo-CH0-G1RDemo_KirgoFight-Hero-59810","",""
"Content/Story/Missions/DIA_GRD_251_Kirgo.d:117","Jest najbardziej wpływowym człowiekiem w Starym Obozie. Poprowadził bunt więźniów i teraz tam rządzi.","オールド・キャンプでは一番強いからな。暴動を仕切ったのも奴だった。","","","Kirgo-CH0-G1RDemo_KirgoFight-Kirgo-34033","",""
"Content/Story/Missions/DIA_GRD_251_Kirgo.d:119","To on mówi królowi, czego chcemy w zamian za rudę, a król to dostarcza.","鉱石と引き換えになにが欲しいかを追うに伝えるのも奴の仕事。王も奴の言うことは聞くんだ。","","","Kirgo-CH0-G1RDemo_KirgoFight-Kirgo-18590","",""
"Content/Story/Missions/DIA_GRD_251_Kirgo.d:120","Rozumiem.","なるほど。","","","Kirgo-CH0-G1RDemo_KirgoFight-Hero-26319","",""
"Content/Story/Missions/DIA_GRD_251_Kirgo.d:120","Jeszcze jedno. Wyglądasz na kogoś, kto potrafi posługiwać się mieczem. Co powiesz na mały sparing?","お前は剣の使い方を知ってそうだな。スパーリングしないか？","","","Kirgo-CH0-G1RDemo_KirgoFight-Kirgo-52548","",""
"Content/Story/Missions/DIA_GRD_251_Kirgo.d:123","W przyszłym tygodniu czeka mnie walka. W zamian nauczę cię kilku sztuczek."," 来週試合があってな。それと引き換えに技を教えてやってもいいぞ。","","","Kirgo-CH0-G1RDemo_KirgoFight-Kirgo-630","",""
"Content/Story/Missions/DIA_GRD_251_Kirgo.d:125","Może za chwilę.","またあとでな。","","False","DIA_GRD_251_Kirgo_Hello_Any_Advice.DIA_GRD_251_Kirgo_Hello.DIA_GRD_251_Kirgo_Hello_Maybe_Later","AI_AddChoice",""
"Content/Story/Missions/DIA_GRD_251_Kirgo.d:126","Dobrze, czemu nie.","しょうがない。いいぞ。","","False","DIA_GRD_251_Kirgo_Hello_Any_Advice.DIA_GRD_251_Kirgo_Hello.DIA_GRD_251_Kirgo_Hello_Why_Not","AI_AddChoice",""
"Content/Story/Missions/DIA_GRD_251_Kirgo.d:127","Wybacz, ale muszę lecieć.","すまない。もう行かないと。","","False","DIA_GRD_251_Kirgo_Hello_Any_Advice.DIA_GRD_251_Kirgo_Hello.DIA_GRD_251_Kirgo_Hello_Sorry_But_No","AI_AddChoice",""
"Content/Story/Missions/DIA_GRD_251_Kirgo.d:131","„Czeka cię walka”?","試合がある？","","False","DIA_GRD_251_Kirgo_Hello_Any_Advice.DIA_GRD_251_Kirgo_Hello.DIA_GRD_251_Kirgo_Hello_Are_You_Going_To_Fight","AI_AddChoice",""
"Content/Story/Missions/DIA_GRD_251_Kirgo.d:134","„Czeka cię walka”?","試合がある？","","","Kirgo-CH0-G1RDemo_KirgoFight-Hero-1372","",""
"Content/Story/Missions/DIA_GRD_251_Kirgo.d:138","Tak, na arenie. Będziesz mógł ją zobaczyć.","ああ、アリーナでな。きっと見ることになるよ。","","","Kirgo-CH0-G1RDemo_KirgoFight-Kirgo-68105","",""
"Content/Story/Missions/DIA_GRD_251_Kirgo.d:145","Wybacz, ale muszę lecieć.","すまない。もう行かないと。","","","Kirgo-CH0-G1RDemo_KirgoFight-Hero-91130","",""
"Content/Story/Missions/DIA_GRD_251_Kirgo.d:151","Trudno. Może innym razem.","それは残念だ。また今度頼むよ。","","","Kirgo-CH0-G1RDemo_KirgoFight-Kirgo-3837","",""
"Content/Story/Missions/DIA_GRD_251_Kirgo.d:154","Dobrze, czemu nie.","しょうがない。いいぞ。  ","","","Kirgo-CH0-G1RDemo_KirgoFight-Hero-95013","",""
"Content/Story/Missions/DIA_GRD_251_Kirgo.d:158","Świetnie! Daj znać, jak będziesz gotowy.","よし！準備ができたら教えてくれ。","","","Kirgo-CH0-G1RDemo_KirgoFight-Kirgo-63047","",""
"Content/Story/Missions/DIA_GRD_251_Kirgo.d:162","Może za chwilę.","またあとでな。","","False","DIA_GRD_251_Kirgo_Hello_Why_Not.DIA_GRD_251_Kirgo_Hello.DIA_GRD_251_Kirgo_Ready_To_Fight_Maybe_Later","AI_AddChoice",""
"Content/Story/Missions/DIA_GRD_251_Kirgo.d:164","Jestem gotowy do walki.","戦う準備ができた。","","False","DIA_GRD_251_Kirgo_Hello_Why_Not.DIA_GRD_251_Kirgo_Hello.DIA_GRD_251_Kirgo_Ready_To_Fight_I_Am_Ready","AI_AddChoice",""
"Content/Story/Missions/DIA_GRD_251_Kirgo.d:236","Dobrze. Ja się nigdzie nie wybieram.","わかった。まだ少しここにいる。","","","Kirgo-CH0-G1RDemo_KirgoFight-Kirgo-41448","",""
"Content/Story/Missions/DIA_GRD_251_Kirgo.d:185","Czy to prawda, że w ogóle nie ma tu kobiet?","ここには女性がいないっていうのは本当か？","","","Kirgo-CH0-None-Hero-24591","",""
"Content/Story/Missions/DIA_GRD_251_Kirgo.d:186","Są, ale tylko te sprowadzone przez Magnatów, by spełniały ich zachcianki. Uważaj, bo jeśli zawiesisz na którejś oko, Gomez każe cię wychłostać.","鉱石貴族が遊びのために所有してる女以外はいないな。見ただけでもゴメスにムチで打たれるぞ。 ","","","Kirgo-CH0-None-Kirgo-12464","",""
"Content/Story/Missions/DIA_GRD_251_Kirgo.d:189","Krążą plotki o jakiejś parze, która uciekła i gdzieś się ukrywa, ale ja w to nie wierzę. Ludzie uwielbiają gadać... i chlać... a potem gadać jeszcze więcej.","脱走したカップルがどこかで隠れて暮らしてるという噂はあるが、どうだろうな。ここではみんな世間話…そして酒を飲むのが好きだから、色々噂は広がるんだ。","","","Kirgo-CH0-None-Kirgo-85213","",""
"Content/Story/Missions/DIA_GRD_251_Kirgo.d:218","Może za chwilę.","またあとでな。","","False","DIA_GRD_251_Kirgo_Ready_To_Fight_Info.DIA_GRD_251_Kirgo_Ready_To_Fight.DIA_GRD_251_Kirgo_Ready_To_Fight_Maybe_Later","AI_AddChoice",""
"Content/Story/Missions/DIA_GRD_251_Kirgo.d:225","Jestem gotowy do walki.","戦う準備ができた。","","False","DIA_GRD_251_Kirgo_Ready_To_Fight_Info.DIA_GRD_251_Kirgo_Ready_To_Fight.DIA_GRD_251_Kirgo_Ready_To_Fight_I_Am_Ready","AI_AddChoice",""
"Content/Story/Missions/DIA_GRD_251_Kirgo.d:279","Jestem gotowy do walki.","戦う準備ができた。","","","Kirgo-CH0-G1RDemo_KirgoFight-Hero-64994","",""
"Content/Story/Missions/DIA_GRD_251_Kirgo.d:300","Czekaj, tak bez broni? Załatw sobie jakąś. Bez tego to jak szczać pod wiatr.","武器もなしにか？まずは武器を入手しろ。じゃないとお前にとって辛いスパーリングになるぞ。","","","Kirgo-CH0-G1RDemo_KirgoFight-Kirgo-39679","",""
"Content/Story/Missions/DIA_GRD_251_Kirgo.d:330","Oj, jak boli... tego się nie spodziewałem. Niezły jesteś... masz potencjał. Ale i tak mogę cię nauczyć paru sztuczek. Zainteresowany?","いてて…予想外だな。悪くない…ポテンシャルはある。それでも技は教えられそうだ。興味はあるか？","","","Kirgo-CH0-G1RDemo_KirgoFight-Kirgo-87315","",""
"Content/Story/Missions/DIA_GRD_251_Kirgo.d:336","To była dobra walka! Nic ci nie złamałem?","ナイスファイトだ！骨折してないか？","","","Kirgo-CH0-G1RDemo_KirgoFight-Kirgo-35355","",""
"Content/Story/Missions/DIA_GRD_251_Kirgo.d:337","... Chyba przeżyję.","…平気だ。","","","Kirgo-CH0-G1RDemo_KirgoFight-Hero-61657","",""
"Content/Story/Missions/DIA_GRD_251_Kirgo.d:340","To dobrze. Nie walczysz źle, kolego. Musisz trochę poćwiczyć, ale masz potencjał. Chcesz, żebym nauczył cię paru sztuczek?","よかった。悪くないぞ。練習は必要だがポテンシャルはある。技を教えてやろうか？ ","","","Kirgo-CH0-G1RDemo_KirgoFight-Kirgo-59331","",""
"Content/Story/Missions/DIA_GRD_251_Kirgo.d:341","Pewnie, czemu nie.","ああ。断る理由はない。","","","Kirgo-CH0-G1RDemo_KirgoFight-Hero-54063-0","",""
"Content/Story/Missions/DIA_GRD_251_Kirgo.d:342","No dobra. Po pierwsze, gdy posługujesz się taką bronią, trzymaj ją jedną ręką, a nie obiema. Gdy nabierzesz nieco mięśni, będziesz znacznie zwinniejszy, co pozwoli ci płynnie łączyć ataki.","よし。まずは、このように武器を使うときは片手で持て。両手じゃない。筋力が付けば、もっと柔軟に攻撃をつなげることができる。","","","Kirgo-CH0-G1RDemo_KirgoFight-Kirgo-565-0","",""
"Content/Story/Missions/DIA_GRD_251_Kirgo.d:346","Po drugie, jeśli podczas wyprowadzania ataku zdasz sobie sprawę, że odsłoni cię to na ripostę przeciwnika, wycofaj się i wykonaj unik. Wymaga to nieco treningu, ale poradzisz sobie.","そして攻撃中に反撃されそうだったら、引いて避けるんだ。練習する必要はあるが、そのうちできるはずだ。","","","Kirgo-CH0-G1RDemo_KirgoFight-Kirgo-95345-0","",""
"Content/Story/Missions/DIA_GRD_251_Kirgo.d:352","Pamiętaj też, aby podczas parowania wyczuć idealny moment. Po idealnej paradzie twój przeciwnik będzie podatny na atak.","最後に、パリィするときは完璧なタイミングを狙うんだ。相手に隙ができるぞ。 ","","","Kirgo-CH0-G1RDemo_KirgoFight-Kirgo-10101","",""
"Content/Story/Missions/DIA_GRD_251_Kirgo.d:353","Rozumiem. Dzięki.","わかった。ありがとう。","","","Kirgo-CH0-G1RDemo_KirgoFight-Hero-55473","",""
"Content/Story/Missions/DIA_GRD_251_Kirgo.d:357","Pamiętaj również, żeby parować w idealnym momencie. Dzięki temu wybijesz wroga z równowagi i będziesz mógł zaatakować.","最後に、パリィするときは完璧なタイミングを狙うんだ。相手がひるんで隙ができるぞ。","","","Kirgo-CH0-G1RDemo_KirgoFight-Kirgo-35698","",""
"Content/Story/Missions/DIA_GRD_251_Kirgo.d:364","Rozumiem. Dzięki.","わかった。ありがとう。","","","Kirgo-CH0-G1RDemo_KirgoFight-Hero-55473-0","",""
"Content/Story/Missions/DIA_GRD_251_Kirgo.d:367","Do usług. Lepiej znajdź sobie jakieś obozowisko. Zaczyna się ściemniać.","どうってことない。そろそろキャンプする名所を探したほうがいいぞ。もうじき暗くなる。 ","","","Kirgo-CH0-G1RDemo_KirgoFight-Kirgo-83210","",""
"Content/Story/Missions/DIA_GRD_251_Kirgo.d:375","Do usług. Lepiej znajdź sobie jakieś obozowisko. Zaczyna się ściemniać.","どうってことない。そろそろキャンプする名所を探したほうがいいぞ。もうじき暗くなる。 ","","","Kirgo-CH0-G1RDemo_KirgoFight-Kirgo-83210-0","",""
"Content/Story/Missions/DIA_GRD_251_Kirgo.d:396","Właściwie to dlaczego jesteś taki przyjazny?","なんでそんなに優しくしてくれるんだ？","","False","DIA_GRD_251_Kirgo_Why_Are_You_Nice.description","",""
"Content/Story/Missions/DIA_GRD_251_Kirgo.d:399","Właściwie to dlaczego jesteś taki przyjazny?","なんでそんなに優しくしてくれるんだ？","","","Kirgo-CH0-G1RDemo_KirgoFight-Hero-21333","",""
"Content/Story/Missions/DIA_GRD_251_Kirgo.d:399","Mówisz, jakby było w tym coś złego. Sam nie wiem. Może dlatego, że pozostali tutaj wyglądają, jakby nie srali od lat, więc próbuję to jakoś zrównoważyć.","まるで悪いことみたいに言うな。わからないよ。ここにいる奴らのほとんどが機嫌悪いからな。バランスを取りたかったのかもしれない。","","","Kirgo-CH0-G1RDemo_KirgoFight-Kirgo-42430-0","",""
"Content/Story/Missions/DIA_GRD_251_Kirgo.d:427","Co powiesz na rewanż?","もう一試合どうだ？","","False","DIA_GRD_251_Kirgo_About_Rematch.description","",""
"Content/Story/Missions/DIA_GRD_251_Kirgo.d:435","Co powiesz na rewanż?","もう一試合どうだ？","","","Kirgo-CH0-G1RDemo_KirgoFight-Hero-57048","",""
"Content/Story/Missions/DIA_GRD_251_Kirgo.d:436","Tak szybko? Pewnie. Powiedz kiedy.","またか？いいぞ。準備ができたら教えてくれ。","","","Kirgo-CH0-G1RDemo_KirgoFight-Kirgo-48441","",""
"Content/Story/Missions/DIA_GRD_251_Kirgo.d:440","Daj mi chwilę.","ちょっと待ってくれ。","","False","DIA_GRD_251_Kirgo_About_Rematch_Info.DIA_GRD_251_Kirgo_About_Rematch.DIA_GRD_251_Kirgo_About_Rematch_Wait","AI_AddChoice",""
"Content/Story/Missions/DIA_GRD_251_Kirgo.d:442","Tym razem się nie powstrzymuj. Daj z siebie wszystko.","今度は手加減しなくていいぞ。","","False","DIA_GRD_251_Kirgo_About_Rematch_Info.DIA_GRD_251_Kirgo_About_Rematch.DIA_GRD_251_Kirgo_About_Rematch_No_Mercy","AI_AddChoice",""
"Content/Story/Missions/DIA_GRD_251_Kirgo.d:451","Walczmy.","戦おう。","","False","DIA_GRD_251_Kirgo_About_Rematch_Info.DIA_GRD_251_Kirgo_About_Rematch.DIA_GRD_251_Kirgo_About_Rematch_Fight","AI_AddChoice",""
"Content/Story/Missions/DIA_GRD_251_Kirgo.d:454","Hm, czemu nie. Tylko najpierw skombinuj sobie jakąś broń.","いいだろう。でも、まずは武器を用意しろ。","","","Kirgo-CH0-G1RDemo_KirgoFight-Kirgo-70786","",""
"Content/Story/Missions/DIA_GRD_251_Kirgo.d:464","Walczmy.","戦おう。","","","Kirgo-CH0-G1RDemo_KirgoFight-Hero-23822","",""
"Content/Story/Missions/DIA_GRD_251_Kirgo.d:464","Dobrze. Pokaż, co potrafisz!","よし。全力でかかってこい！","","","Kirgo-CH0-G1RDemo_KirgoFight-Kirgo-18035","",""
"Content/Story/Missions/DIA_GRD_251_Kirgo.d:473","Tym razem się nie powstrzymuj. Daj z siebie wszystko.","今度は手加減しなくていいぞ。","","","Kirgo-CH0-G1RDemo_KirgoFight-Hero-92998","",""
"Content/Story/Missions/DIA_GRD_251_Kirgo.d:474","Jesteś pewny? No dobrze, zatańczmy.","本当か？よし、全力で来い。","","","Kirgo-CH0-G1RDemo_KirgoFight-Kirgo-72913","",""
"Content/Story/Missions/DIA_GRD_251_Kirgo.d:483","Daj mi chwilę.","ちょっと待ってくれ。","","","Kirgo-CH0-G1RDemo_KirgoFight-Hero-17711","",""
"Content/Story/Missions/DIA_GRD_251_Kirgo.d:487","Dobrze. Wiesz, gdzie mnie szukać.","わかった。いつでも来てくれ。","","","Kirgo-CH0-G1RDemo_KirgoFight-Kirgo-27576","",""
"Content/Story/Missions/DIA_GRD_251_Kirgo.d:520","Nieźle... Tego się nie spodziewałem.","悪くない…予想外の動きだ。","","","Kirgo-CH0-None-Kirgo-65501","",""
"Content/Story/Missions/DIA_GRD_251_Kirgo.d:522","Dobra walka. Idzie ci coraz lepiej!","いいぞ！上達してきたな！","","","Kirgo-CH0-None-Kirgo-22502","",""
"Content/Story/Missions/DIA_GRD_251_Kirgo.d:522","Muszę wracać do roboty. Do zobaczenia.","そろそろ仕事に戻らないとな。またな。","","","Kirgo-CH0-None-Kirgo-30285-0","",""
