"location","source","target","id","fuzzy","context","translator_comments","developer_comments"
"Content/Story/Missions/DIA_ORG_818_Ratford.d:27","A kim ty niby jesteś, na Beliara?","În numele lui Beliar, dar cine ești tu?","","","Ratford-CH0-None-Ratford-64245-1","",""
"Content/Story/Missions/DIA_ORG_818_Ratford.d:30","Jestem Nyr...","Sunt Nyr-","","","Ratford-CH0-None-Hero-87298","",""
"Content/Story/Missions/DIA_ORG_818_Ratford.d:31","Nie o imię pytam. Nie wyglądasz mi na członka któregoś obozu. To co, jesteś kopaczem? A może dopiero co cię wrzucili?","Nu numele tău. Nu pari să fi de la nici una din tabere - ești săpător? Sau tocmai ai fost aruncat înăuntru? ","","","Ratford-CH0-None-Ratford-66784","",""
"Content/Story/Missions/DIA_ORG_818_Ratford.d:35","Tak, jestem nowy. Drax, przysłał mnie do ciebie, mam pomóc w zamian za nocleg w waszym obozie.","Sunt nou, da. Prietenul tău Drax m-a trimis să te ajut, la schimb pentru un loc de dormit la tabăra voastră.","","False","DIA_ORG_818_Ratford_Hello_Info.DIA_ORG_818_Ratford_Hello.DIA_ORG_818_Ratford_Hello_About_Help","AI_AddChoice",""
"Content/Story/Missions/DIA_ORG_818_Ratford.d:40","Dopiero mnie tu wrzucili. Szukam bezpiecznego miejsca na nocleg.","Tocmai m-au aruncat înăuntru. Caut un loc ferit unde să înnoptez.","","False","DIA_ORG_818_Ratford_Hello_Info.DIA_ORG_818_Ratford_Hello.DIA_ORG_818_Ratford_Hello_About_Sleep_Place","AI_AddChoice",""
"Content/Story/Missions/DIA_ORG_818_Ratford.d:48","Tak, jestem nowy. Drax, przysłał mnie do ciebie, mam pomóc w zamian za nocleg w waszym obozie.","Sunt nou, da. Prietenul tău Drax m-a trimis să te ajut, la schimb pentru un loc de dormit la tabăra voastră.","","","Ratford-CH0-None-Hero-42595","",""
"Content/Story/Missions/DIA_ORG_818_Ratford.d:49","Czyżby? Nie potrzebuję pomocy, zwłaszcza od takiej pizdy jak ty, a już na pewno nie pozwolę obcemu spać przy naszym ognisku. Zabieraj się stąd. W podskokach.","Chiar așa? Păi, n-am nevoie de ajutor, în special nu de la un vărzălău ca tine, sunt al naibii de sigur că n-o să las un necunoscut să doarmă la focul nostru. Valea de aici.","","","Ratford-CH0-None-Ratford-50882","",""
"Content/Story/Missions/DIA_ORG_818_Ratford.d:51","Jak chcesz.","Bine.","","False","DIA_ORG_818_Ratford_Hello_About_Help.DIA_ORG_818_Ratford_Hello.DIA_ORG_818_Ratford_Hello_If_You_Think_So","AI_AddChoice",""
"Content/Story/Missions/DIA_ORG_818_Ratford.d:52","Zamknij już kurwa ten ryj.","Ai grijă la ce căcat spui.","","False","DIA_ORG_818_Ratford_Hello_About_Help.DIA_ORG_818_Ratford_Hello.DIA_ORG_818_Ratford_Hello_Fuck_You","AI_AddChoice",""
"Content/Story/Missions/DIA_ORG_818_Ratford.d:53","Mogę cię jakoś przekonać?","Ce pot să fac să te conving?","","False","DIA_ORG_818_Ratford_Hello_About_Help.DIA_ORG_818_Ratford_Hello.DIA_ORG_818_Ratford_Hello_Can_I_Convince_You_Somehow","AI_AddChoice",""
"Content/Story/Missions/DIA_ORG_818_Ratford.d:54","Ale przecież się z nim dogadałem.","Dar prietenul tău a făcut o înțelegere cu mine.","","False","DIA_ORG_818_Ratford_Hello_About_Help.DIA_ORG_818_Ratford_Hello.DIA_ORG_818_Ratford_Hello_But_I_Talked_To_Drax","AI_AddChoice",""
"Content/Story/Missions/DIA_ORG_818_Ratford.d:62","Ale przecież się z nim dogadałem.","Dar prietenul tău a făcut o înțelegere cu mine.","","","Ratford-CH0-None-Hero-30527","",""
"Content/Story/Missions/DIA_ORG_818_Ratford.d:63","Taa, ale ze mną nie. Drax to łatwowierny idiota, który poczęstowałby orków piwem, bo pewnie im gorąco od tego słońca.","Da, tu cu el, nu cu mine. Drax e un credul care ar da o bere unui orc pe o zi însorită. ","","","Ratford-CH0-None-Ratford-72328","",""
"Content/Story/Missions/DIA_ORG_818_Ratford.d:64","Przykro mi, ale nic z tego.","Scuze, dar nu se va întâmpla.","","","Ratford-CH0-None-Ratford-4113-0","",""
"Content/Story/Missions/DIA_ORG_818_Ratford.d:75","Mogę cię jakoś przekonać?","Ce pot să fac să te conving?","","","Ratford-CH0-None-Hero-34959","",""
"Content/Story/Missions/DIA_ORG_818_Ratford.d:76","Słuchaj, nie chcę wychodzić na dupka. Naprawdę. Ale cię nie znam, a okazywanie zaufania ludziom, których się nie zna, to prosty sposób na szybki zgon.","Uite, nu vreau să fiu dobitoc, pe bune. Dar nu te cunosc, și s-ai 'ncredere-n lume ce nu cunoști e cea mai rapidă cale să ajungi în șanț. ","","","Ratford-CH0-None-Ratford-35655","",""
"Content/Story/Missions/DIA_ORG_818_Ratford.d:87","Zamknij już kurwa ten ryj.","Ai grijă la ce căcat spui.","","","Ratford-CH0-None-Hero-26237","",""
"Content/Story/Missions/DIA_ORG_818_Ratford.d:88","No i sobie nagrabiłeś.","Mare greșeală.","","","Ratford-CH0-None-Ratford-60669","",""
"Content/Story/Missions/DIA_ORG_818_Ratford.d:101","Jak chcesz.","Bine.","","","Ratford-CH0-None-Hero-69849","",""
"Content/Story/Missions/DIA_ORG_818_Ratford.d:101","Przykro mi, chłopie. Znajdziesz sobie coś innego.","Scuze, amice. O să găsești tu ceva.","","","Ratford-CH0-None-Ratford-45016","",""
"Content/Story/Missions/DIA_ORG_818_Ratford.d:102","Powodzenia życzę.","Mult noroc.","","","Ratford-CH0-None-Ratford-99079-1","",""
"Content/Story/Missions/DIA_ORG_818_Ratford.d:112","Dopiero mnie tu wrzucili. Szukam bezpiecznego miejsca na nocleg.","Tocmai m-au aruncat înăuntru. Caut un loc ferit unde să înnoptez.","","","Ratford-CH0-None-Hero-81996","",""
"Content/Story/Missions/DIA_ORG_818_Ratford.d:113","To idź do Starego Obozu.","Atunci du-te la Tabăra Veche. ","","","Ratford-CH0-None-Ratford-13684","",""
"Content/Story/Missions/DIA_ORG_818_Ratford.d:114","Tamten Varantczyk powiedział, że muszę poczekać, aż Kopacze oczyszczą szlak.","Varantianul mi-a zis să aștept până săpătorii termină de curățat molozul.","","","Ratford-CH0-None-Hero-15424","",""
"Content/Story/Missions/DIA_ORG_818_Ratford.d:115","No to zaczekaj. Słuchaj, nic ode mnie nie dostaniesz, więc nie zawracaj mi dupy.","Atunci așteaptă. Uite, n-am nimic pentru tine, bobocule, ok? Marș de aici. ","","","Ratford-CH0-None-Ratford-99940","",""
"Content/Story/Missions/DIA_ORG_818_Ratford.d:145","Co?!","Ce?","","","Ratford-CH0-None-Ratford-14986","",""
"Content/Story/Missions/DIA_ORG_818_Ratford.d:145","Pójdę już.","Mă duc.","","False","DIA_ORG_818_Ratford_Hello_Again_Info.DIA_ORG_818_Ratford_Hello_Again.DIA_ORG_818_Ratford_Hello_Again_I_Will_Go_Now","AI_AddChoice",""
"Content/Story/Missions/DIA_ORG_818_Ratford.d:146","Ty też jesteś z tego Nowego Obozu?","Și tu ești din „Tabăra Nouă”?","","False","DIA_ORG_818_Ratford_Hello_Again_Info.DIA_ORG_818_Ratford_Hello_Again.DIA_ORG_818_Ratford_Hello_Again_Are_You_From_New_Camp","AI_AddChoice",""
"Content/Story/Missions/DIA_ORG_818_Ratford.d:147","Co cię ugryzło?","Ai o problemă?","","False","DIA_ORG_818_Ratford_Hello_Again_Info.DIA_ORG_818_Ratford_Hello_Again.DIA_ORG_818_Ratford_Hello_Again_What_Do_You_Mean","AI_AddChoice",""
"Content/Story/Missions/DIA_ORG_818_Ratford.d:154","Co cię ugryzło?","Ai o problemă?","","","Ratford-CH0-None-Hero-74210","",""
"Content/Story/Missions/DIA_ORG_818_Ratford.d:154","Parę wkurwiających robali. Na przykład taki jeden kretyn, który nie wie, kiedy odpuścić.","Câteva, defapt. Una din ele e idiotul de aici care numa' nu pricepe să tacă.","","","Ratford-CH0-None-Ratford-1706","",""
"Content/Story/Missions/DIA_ORG_818_Ratford.d:161","Ty też jesteś z tego Nowego Obozu?","Și tu ești din „Tabăra Nouă”?","","","Ratford-CH0-None-Hero-28264","",""
"Content/Story/Missions/DIA_ORG_818_Ratford.d:165","Jakim cudem zgadłeś?","Cum ai ghicit?","","","Ratford-CH0-None-Ratford-73615","",""
"Content/Story/Missions/DIA_ORG_818_Ratford.d:170","Pójdę już.","Mă duc.","","","Ratford-CH0-None-Hero-91268","",""
"Content/Story/Missions/DIA_ORG_818_Ratford.d:175","Mmm.","Hmm.","","","Ratford-CH0-None-Ratford-40335","",""
"Content/Story/Missions/DIA_ORG_818_Ratford.d:179","Tak po prostu?","Chiar așa?","","False","Ratford_CH0_G1RDemo_DraxHunt_Caption_9934_0","",""
"Content/Story/Missions/DIA_ORG_818_Ratford.d:180","Świetnie. Dziękuję.","Bine. Mulțumesc","","False","Ratford_CH0_G1RDemo_DraxHunt_Caption_25858_0","",""
"Content/Story/Missions/DIA_ORG_818_Ratford.d:201","No tak. Nie żyje. Kurwa. To pewnie robota cieniostwora.","Deci, e mort ... drăcie. L-o fi prins bestia-umbră.","","","TEXT_HECTO_20230817_110702_41","",""
"Content/Story/Missions/DIA_ORG_818_Ratford.d:202","Znałeś go?","Îl cunoșteai?","","","Ratford-CH0-G1RDemo_DraxHunt-Hero-46542","",""
"Content/Story/Missions/DIA_ORG_818_Ratford.d:202","Był z naszego gangu, więc tak. Właśnie dlatego jesteśmy tutaj z kumplem.","Era din gașca noastră, deci da. De asta eu și pretenul meu suntem aici.","","","Ratford-CH0-G1RDemo_DraxHunt-Ratford-56356","",""
"Content/Story/Missions/DIA_ORG_818_Ratford.d:203","Głupek uzależnił się od tego zielska, które sprzedają kultyści i zaczęło mu odwalać.","Fraierul a devenit dependent de iarba aia de la cultiști și a început să-și piardă mințile.","","","Ratford-CH0-G1RDemo_DraxHunt-Ratford-72197","",""
"Content/Story/Missions/DIA_ORG_818_Ratford.d:204","Jak go widziałem po raz ostatni, to bredził coś o tym, jak to ich bóg gadał do niego we śnie. Kołowaty, jak nic.","Ultima dată când l-am văzut, tot zicea cum zeul lor îi vorbește în somn, măgării din astea.","","","Ratford-CH0-G1RDemo_DraxHunt-Ratford-41347","",""
"Content/Story/Missions/DIA_ORG_818_Ratford.d:205","A potem, tydzień temu, po prostu wyszedł z obozu w samym środku nocy i już nie wrócił.","Și apoi, acu' o săptămână, pur și simplu a plecat din tabăra noastră în mijlocul nopții și nu a mai revenit.","","","Ratford-CH0-G1RDemo_DraxHunt-Ratford-76574","",""
"Content/Story/Missions/DIA_ORG_818_Ratford.d:214","Słuchaj, znalazłem to przy nieboszczyku.","Uite, am găsit asta pe omul vostru.","","False","DIA_ORG_818_Ratford_Who_Are_You_Common_No_Offence.DIA_ORG_818_Ratford_Who_Are_You.DIA_ORG_818_Ratford_Who_Are_You_About_Mysterious_Note","AI_AddChoice",""
"Content/Story/Missions/DIA_ORG_818_Ratford.d:219","Co teraz?","Ce facem acum?","","False","DIA_ORG_818_Ratford_Who_Are_You_Common_No_Offence.DIA_ORG_818_Ratford_Who_Are_You.DIA_ORG_818_Ratford_Who_Are_You_What_Now","AI_AddChoice",""
"Content/Story/Missions/DIA_ORG_818_Ratford.d:220","Ten bóg... istnieje naprawdę?","Zeul ăla - e adevărat?","","False","DIA_ORG_818_Ratford_Who_Are_You_Common_No_Offence.DIA_ORG_818_Ratford_Who_Are_You.DIA_ORG_818_Ratford_Who_Are_You_About_God","AI_AddChoice",""
"Content/Story/Missions/DIA_ORG_818_Ratford.d:221","Co to za sekta?","Ce este acel cult de care vorbești?","","False","DIA_ORG_818_Ratford_Who_Are_You_Common_No_Offence.DIA_ORG_818_Ratford_Who_Are_You.DIA_ORG_818_Ratford_Who_Are_You_About_Sect_Camp","AI_AddChoice",""
"Content/Story/Missions/DIA_ORG_818_Ratford.d:222","Mówisz o bagiennym zielu?","Vorbești de iarbă de mlaștină?","","False","DIA_ORG_818_Ratford_Who_Are_You_Common_No_Offence.DIA_ORG_818_Ratford_Who_Are_You.DIA_ORG_818_Ratford_Who_Are_You_About_Swamp_Herb","AI_AddChoice",""
"Content/Story/Missions/DIA_ORG_818_Ratford.d:224","Bóg mówił do niego we śnie?","Un zeu i-a vorbit în vis?","","False","DIA_ORG_818_Ratford_Who_Are_You_Common_No_Offence.DIA_ORG_818_Ratford_Who_Are_You.DIA_ORG_818_Ratford_Who_Are_You_About_Sleep","AI_AddChoice",""
"Content/Story/Missions/DIA_ORG_818_Ratford.d:236","Kim jesteś?","Cine ești?","","","Ratford-CH0-None-Ratford-40635","",""
"Content/Story/Missions/DIA_ORG_818_Ratford.d:237","Nie celuj tym we mnie.","Nu ținti spre mine.","","False","DIA_ORG_818_Ratford_Who_Are_You_Info.DIA_ORG_818_Ratford_Who_Are_You.DIA_ORG_818_Ratford_Who_Are_You_Put_Away_Your_Weapon","AI_AddChoice",""
"Content/Story/Missions/DIA_ORG_818_Ratford.d:243","Tak go znalazłem.","L-am găsit așa.","","False","DIA_ORG_818_Ratford_Who_Are_You_Info.DIA_ORG_818_Ratford_Who_Are_You.DIA_ORG_818_Ratford_Who_Are_You_This_Is_How_I_Found_Jorik","AI_AddChoice",""
"Content/Story/Missions/DIA_ORG_818_Ratford.d:245","Znowu ty.","Iar tu.","","","Ratford-CH0-None-Ratford-29260","",""
"Content/Story/Missions/DIA_ORG_818_Ratford.d:247","Chyba znalazłem twojego kumpla.","Cred că ți-am găsit omul. ","","","Ratford-CH0-None-Hero-22878","",""
"Content/Story/Missions/DIA_ORG_818_Ratford.d:247","Właśnie widzę.","Văd și eu. ","","","Ratford-CH0-None-Ratford-80190","",""
"Content/Story/Missions/DIA_ORG_818_Ratford.d:264","Nie celuj tym we mnie.","Nu ținti spre mine.","","","Ratford-CH0-None-Hero-57489","",""
"Content/Story/Missions/DIA_ORG_818_Ratford.d:269","Zła odpowiedź.","Răspuns greșit.","","","Ratford-CH0-None-Ratford-67380","",""
"Content/Story/Missions/DIA_ORG_818_Ratford.d:274","Tak go znalazłem.","L-am găsit așa. ","","","Ratford-CH0-None-Hero-63229","",""
"Content/Story/Missions/DIA_ORG_818_Ratford.d:274","Wiem. Usłyszałbym odgłosy walki. Kim jesteś?","Mi-am dat seama, aș fi auzit o luptă. Cine ești?","","","Ratford-CH0-None-Ratford-52590","",""
"Content/Story/Missions/DIA_ORG_818_Ratford.d:275","Jestem tu nowy. Szukałem bezpiecznego miejsca na nocleg i znalazłem jego ciało.","Sunt nou. Căutam un loc sigur să înnoptez și l-am găsit așa.","","","Ratford-CH0-None-Hero-18505","",""
"Content/Story/Missions/DIA_ORG_818_Ratford.d:277","Żółtodziób? Nie spodziewałem się dzisiaj świeżynek.","Un boboc? Credeam că n-aduc nici unu' azi.","","","Ratford-CH0-None-Ratford-16882","",""
"Content/Story/Missions/DIA_ORG_818_Ratford.d:278","No a jednak.","Păi, iată-mă.","","","Ratford-CH0-None-Hero-55046","",""
"Content/Story/Missions/DIA_ORG_818_Ratford.d:283","Hmm.","Hmm. ","","","Ratford-CH0-None-Ratford-81347","",""
"Content/Story/Missions/DIA_ORG_818_Ratford.d:284","Dobra, wierzę ci.","Bine. Te cred.","","","Ratford-CH0-None-Ratford-80505","",""
"Content/Story/Missions/DIA_ORG_818_Ratford.d:291","Bóg mówił do niego we śnie?","Un zeu i-a vorbit în vis?","","","Ratford-CH0-G1RDemo_DraxHunt-Hero-41798","",""
"Content/Story/Missions/DIA_ORG_818_Ratford.d:295","„Szeptał”, chyba tego słowa użył. Tak się kończy palenie zielska od tych wariatów.","„Șoptit”, cred că a zis, dar da. Asta face iarba aia din tine. ","","","Ratford-CH0-G1RDemo_DraxHunt-Ratford-90716","",""
"Content/Story/Missions/DIA_ORG_818_Ratford.d:298","Mówisz o bagiennym zielu?","Vorbești de iarbă de mlaștină?","","","Ratford-CH0-G1RDemo_DraxHunt-Hero-52915","",""
"Content/Story/Missions/DIA_ORG_818_Ratford.d:299","Ta. W dolinie jest bagno, a sekta, która tam urzęduje, uprawia i sprzedaje to zielsko.","Da. E o mlaştină în Vale, și secta care ocupă locul o crește și o vinde. ","","","Ratford-CH0-G1RDemo_DraxHunt-Ratford-28568","",""
"Content/Story/Missions/DIA_ORG_818_Ratford.d:302","Najwyraźniej palą je, bo „otwiera umysł na mądrość ich boga”, ale wielu ludzi spoza sekty też po nie sięga. Podobno pomaga się rozluźnić.","Aparent o fumează pentru că „le deschide mințile la zeul lor”, dar multă lume din afara sectei o folosește pentru că îi calmează.","","","Ratford-CH0-G1RDemo_DraxHunt-Ratford-82831","",""
"Content/Story/Missions/DIA_ORG_818_Ratford.d:307","Co to za sekta?","Ce este acel cult de care vorbești?","","","Ratford-CH0-G1RDemo_DraxHunt-Hero-3445","",""
"Content/Story/Missions/DIA_ORG_818_Ratford.d:307","No tak... Zapominam, że jesteś tu nowy.","A da ...ești nou aici.","","","Ratford-CH0-G1RDemo_DraxHunt-Ratford-56576","",""
"Content/Story/Missions/DIA_ORG_818_Ratford.d:309","W dużym skrócie: mamy tu w Kolonii trzy obozy, a jeden z nich to powaleni sekciarze.","Povestea lungă scurtă, sunt trei tabere în Colonie, iar una din ele e o sectă. ","","","Ratford-CH0-G1RDemo_DraxHunt-Ratford-61788","",""
"Content/Story/Missions/DIA_ORG_818_Ratford.d:309","Podobno ich naczelny wariat sześć lat temu miał wizję jakiegoś przedwiecznego boga, który ma się obudzić i zbawić ich wszystkich, więc przenieśli się na bagna. Do dziś tam mieszkają.","Vorba zice, că capetenia bolundă a avut ceva viziune acu' șase ani cum că ceva zeu vechi urma să se trezească și să-i salveze, așa că s-au mutat în mlaştină. Locuiesc 'colo de atunci.","","","Ratford-CH0-G1RDemo_DraxHunt-Ratford-95458","",""
"Content/Story/Missions/DIA_ORG_818_Ratford.d:316","Ten bóg... istnieje naprawdę?","Zeul ăla - e adevărat?","","","Ratford-CH0-G1RDemo_DraxHunt-Caption-40855-0","",""
"Content/Story/Missions/DIA_ORG_818_Ratford.d:320","Jasne, że nie. Ten ich szef, Y’Berion, po prostu wykorzystuje to, że desperacko chcą się stąd wydostać.","Clar că nu. Stăpânul ăla al lor, Y'Berion, îi joacă pe degete la cât de disperați îs să iasă.  ","","","Ratford-CH0-G1RDemo_DraxHunt-Ratford-87472","",""
"Content/Story/Missions/DIA_ORG_818_Ratford.d:324","Słuchaj, znalazłem to przy nieboszczyku.","Uite, am găsit asta pe omul vostru.","","","Ratford-CH0-G1RDemo_DraxHunt-Hero-99331","",""
"Content/Story/Missions/DIA_ORG_818_Ratford.d:410","List?","O scrisoare? ","","","Ratford-CH0-G1RDemo_DraxHunt-Ratford-7287-0","",""
"Content/Story/Missions/DIA_ORG_818_Ratford.d:411","Nie, rysunek. I jakieś symbole.","Nu, un desen. Și are ceva simboluri. ","","","Ratford-CH0-G1RDemo_DraxHunt-Hero-43548-0","",""
"Content/Story/Missions/DIA_ORG_818_Ratford.d:412","He. Musiał to nabazgrać, kiedy był już porobiony. Możesz to wziąć.","... ăă. Probabil a mâzgălit-o când era trosnit. Păstreaz-o. ","","","Ratford-CH0-G1RDemo_DraxHunt-Ratford-41888-0","",""
"Content/Story/Missions/DIA_ORG_818_Ratford.d:413","Co teraz? Zabierzesz go z powrotem do obozu?","Și acum? O să îl duci înapoi la tabără?","","","Ratford-CH0-G1RDemo_DraxHunt-Hero-9744-0","",""
"Content/Story/Missions/DIA_ORG_818_Ratford.d:413","Nie. Przeczekamy tu noc, a jutro wrócimy do obozu i powiemy szefowi, że Jorik nie żyje. I po temacie.","Nu. Petrecem seara aici, mergem la bază mâinie, și îi zicem la șeful nostru că Jorik a crăpat. Atât. ","","","Ratford-CH0-G1RDemo_DraxHunt-Ratford-23899-0","",""
"Content/Story/Missions/DIA_ORG_818_Ratford.d:415","To ten... mówiłeś, że szukasz bezpiecznego miejsca na obóz, tak? Dobry pomysł, zwłaszcza że w okolicy grasuje cieniostwór.","Deci ... ziceai că cauți un loc sigur unde să înnoptezi, așa-i? O idee bună având în vedere bestia-umbră ce bântuie prin zonă.","","","Ratford-CH0-G1RDemo_DraxHunt-Ratford-72836-0","",""
"Content/Story/Missions/DIA_ORG_818_Ratford.d:417","Taa.","Da.","","","Ratford-CH0-G1RDemo_DraxHunt-Hero-90162-0","",""
"Content/Story/Missions/DIA_ORG_818_Ratford.d:418","Dobra już chuj tam – możesz spać przy naszym ognisku. W starym obozie Kopaczy po drugiej stronie Opuszczonej Kopalni. Stwór się tam nie zapuści.","Hmm. Ah, păi, ce naiba - poți să dormi la focul nostru. E la vechea tabără a săpătorilor vizavi de Mina Abandonată, nu cred că o să se apropie bestia. ","","","Ratford-CH0-G1RDemo_DraxHunt-Ratford-32267-0","",""
"Content/Story/Missions/DIA_ORG_818_Ratford.d:349","Co teraz?","Ce facem acum?","","","Ratford-CH0-G1RDemo_DraxHunt-Hero-99334","",""
"Content/Story/Missions/DIA_ORG_818_Ratford.d:352","Przeszukałeś zwłoki?","I-ai verificat cadavrul?","","","Ratford-CH0-G1RDemo_DraxHunt-Ratford-23614-3","",""
"Content/Story/Missions/DIA_ORG_818_Ratford.d:388","Zobaczmy, co ma przy sobie.","Să vedem ce are pe el.","","","Ratford-CH0-None-Ratford-44653","",""
"Content/Story/Missions/DIA_ORG_818_Ratford.d:410","Co to?","Ce-i aia?","","","Ratford-CH0-G1RDemo_DraxHunt-Ratford-63489","",""
"Content/Story/Missions/DIA_ORG_818_Ratford.d:439","Mój kumpel, Drax, powinien już być w obozie. Idziemy.","Pretenul meu, Drax, ar trebui să fie deja la tabără. Hai, să mergem.","","","Ratford-CH0-G1RDemo_DraxHunt-Ratford-62191-1","",""
"Content/Story/Missions/DIA_ORG_818_Ratford.d:442","Tak czy siak, kolacji nie będzie, dopóki Drax nie upoluje dla nas paru ścierwojadów.","Zicând asta, n-o să fie nici o cină până ce pretenul meu Drax nu vânează niște necroi. ","","","Ratford-CH0-G1RDemo_DraxHunt-Ratford-32587-0","",""
"Content/Story/Missions/DIA_ORG_818_Ratford.d:444","Może ty mu pomożesz? Będzie mógł cię wtedy poznać.","Ce zici să-l ajuți? Așa te cunoaște și el.","","","Ratford-CH0-G1RDemo_DraxHunt-Ratford-15507-0","",""
"Content/Story/Missions/DIA_ORG_818_Ratford.d:447","Gdzie go szukać?","Unde pot să îl găsesc. ","","","Ratford-CH0-G1RDemo_DraxHunt-Hero-94901-0","",""
"Content/Story/Missions/DIA_ORG_818_Ratford.d:451","Idź tą drogą, aż dojdziesz do doliny. Powinien być gdzieś w okolicy. Spotkamy się w obozie.","Urmează drumul spre vale, ar trebui să fie pe acolo. Eu o să te aștept la tabără.  ","","","Ratford-CH0-G1RDemo_DraxHunt-Ratford-26907-1","",""
"Content/Story/Missions/DIA_ORG_818_Ratford.d:459","Spotkamy się w obozie.","Ne vedem la tabără.  ","","","Ratford-CH0-G1RDemo_DraxHunt-Ratford-26907-2","",""
"Content/Story/Missions/DIA_ORG_818_Ratford.d:463","Tak po prostu?","Chiar așa?","","","Ratford-CH0-G1RDemo_DraxHunt-Hero-9934-0","",""
"Content/Story/Missions/DIA_ORG_818_Ratford.d:466","Pewnie nie znalazłbym nieboszczyka przed zmrokiem, gdybyś nie postanowił pobuszować po krzakach.","Dacă nu te-ai fi agitat prin tufe, probabil nu aș fi găsit omul înainte de apus. ","","","Ratford-CH0-G1RDemo_DraxHunt-Ratford-90459-0","",""
"Content/Story/Missions/DIA_ORG_818_Ratford.d:472","Świetnie. Dziękuję.","Bine. Mulțumesc ","","","Ratford-CH0-G1RDemo_DraxHunt-Hero-25858-0","",""
"Content/Story/Missions/DIA_ORG_818_Ratford.d:476","To ja ci dziękuję. Pewnie nie znalazłbym nieboszczyka przed zmrokiem gdybyś nie postanowił pobuszować po krzakach.","Eu ar trebui să-ți mulțumesc - dacă nu te-ai fi agitat prin tufe, probabil nu aș fi găsit omul înainte de apus. ","","","Ratford-CH0-G1RDemo_DraxHunt-Ratford-32619-0","",""
"Content/Story/Missions/DIA_ORG_818_Ratford.d:510","Co? Znajdźmy Draxa.","Ce? Hai să îl găsim pe Drax. ","","","Ratford-CH0-None-Ratford-26027","",""
"Content/Story/Missions/DIA_ORG_818_Ratford.d:513","No dobrze.","Am înțeles.","","False","DIA_ORG_818_Ratford_Go_Camp_Smalltalk_Info.DIA_ORG_818_Ratford_Go_Camp_Smalltalk.DIA_ORG_818_Ratford_Go_Camp_Smalltalk_Good","AI_AddChoice",""
"Content/Story/Missions/DIA_ORG_818_Ratford.d:518","Jak tu trafiłeś?","Tu cum ai nimerit aici?","","False","DIA_ORG_818_Ratford_Go_Camp_Smalltalk_Info.DIA_ORG_818_Ratford_Go_Camp_Smalltalk.DIA_ORG_818_Ratford_Go_Camp_Smalltalk_How_Did_You_End_Here","AI_AddChoice",""
"Content/Story/Missions/DIA_ORG_818_Ratford.d:525","Jak jest w tym obozie, do którego należysz?","Acea tabără de unde vii - cum e?","","False","DIA_ORG_818_Ratford_Go_Camp_Smalltalk_Info.DIA_ORG_818_Ratford_Go_Camp_Smalltalk.DIA_ORG_818_Ratford_Go_Camp_Smalltalk_How_Is_In_New_Camp","AI_AddChoice",""
"Content/Story/Missions/DIA_ORG_818_Ratford.d:535","No dobrze.","Am înțeles.","","","Ratford-CH0-None-Hero-75802","",""
"Content/Story/Missions/DIA_ORG_818_Ratford.d:540","Jak tu trafiłeś?","Tu cum ai nimerit aici?","","","Ratford-CH0-None-Hero-63685","",""
"Content/Story/Missions/DIA_ORG_818_Ratford.d:542","Słuchaj, jestem ci dłużny za znalezienie Jorika, ale nie będę ci się zwierzać.","Uite - Ți-s dator că l-ai găsit pe Jorik, dar nu înseamnă că suntem prieteni acum. ","","","Ratford-CH0-None-Ratford-21599","",""
"Content/Story/Missions/DIA_ORG_818_Ratford.d:545","Jak chcesz pogadać, to uderz do Draxa. Ten dureń pytluje jęzorem jak stara przekupa po paru głębszych.","Încearcă cu Drax dacă ești așa de dornic de vorbă. Omul ăla vorbește ca o spălătoreasă după o sticlă de rom.","","","Ratford-CH0-None-Ratford-67954","",""
"Content/Story/Missions/DIA_ORG_818_Ratford.d:553","Jak jest w tym obozie, do którego należysz?","Acea tabără de unde vii - cum e?","","","Ratford-CH0-None-Hero-36270","",""
"Content/Story/Missions/DIA_ORG_818_Ratford.d:553","W Nowym Obozie? Jest w porządku.","Tabăra Nouă, vrei să zici? Nu-i rea. ","","","Ratford-CH0-None-Ratford-97063","",""
"Content/Story/Missions/DIA_ORG_818_Ratford.d:555","Musisz umieć o siebie zadbać, ale jeśli to potrafisz, masz dużo więcej swobody niż w pozostałych obozach.","Trebe să ai grijă de tine, dar dacă poți face asta, ești mai liber ca în celelalte tabere.","","","Ratford-CH0-None-Ratford-72398","",""
"Content/Story/Missions/DIA_ORG_818_Ratford.d:556","Ach, no i Magowie Wody, którzy z nami mieszkają, sądzą, że zdołają nas stąd wydostać.","O, și desigur, Magii de Apă care locuiesc cu noi cred că pot să ne scoată de aici.","","","Ratford-CH0-None-Ratford-18169","",""
"Content/Story/Missions/DIA_ORG_818_Ratford.d:557","Naprawdę? Niby jak?","Pe bune? Cum?","","","Ratford-CH0-None-Hero-85496","",""
"Content/Story/Missions/DIA_ORG_818_Ratford.d:557","Chcą wysadzić wielką kupę niebieskiej rudy. Co, według mnie jest jeszcze durniejsze, niż się wydaje.","Vor să arunce în aer o grămadă de minereu albastru - care, dacă mă întrebi pe mine, e o mare tâmpenie. ","","","Ratford-CH0-None-Ratford-7074","",""
"Content/Story/Missions/DIA_ORG_818_Ratford.d:560","No ale, tak szczerze, to nasz obóz jest w porządku, ale zapomnij o wolności.","Sincer, tabăra noastră e în regulă, dar uită de planul de scăpare. ","","","Ratford-CH0-None-Ratford-42915","",""
"Content/Story/Missions/DIA_ORG_818_Ratford.d:560","Stary Obóz, Nowy Obóz, Obóz Bractwa... nikt się stąd nie wydostanie.","Tabăra Veche, Tabăra Nouă, Tabăra din Mlaștină ... noi nu scăpăm de aici. ","","","Ratford-CH0-None-Ratford-86658","",""
"Content/Story/Missions/DIA_ORG_818_Ratford.d:560","Tak już musi być.","Așa stau lucrurile.","","","Ratford-CH0-None-Ratford-78201","",""
