"location","source","target","id","fuzzy","context","translator_comments","developer_comments"
"Content/Story/Missions/DIA_GRD_251_Kirgo.d:27","Proszę, proszę. Nowa twarz. Dopiero co cię wrzucili?","Guarda un po', una faccia nuova. Ti hanno appena buttato dentro?","","","Kirgo-CH0-None-Kirgo-13159","",""
"Content/Story/Missions/DIA_GRD_251_Kirgo.d:29","Nie twój interes.","","","","DIA_GRD_251_Kirgo_Hello_Info.DIA_GRD_251_Kirgo_Hello.DIA_GRD_251_Kirgo_Hello_Not_Your_Business","AI_AddChoice",""
"Content/Story/Missions/DIA_GRD_251_Kirgo.d:30","Tak.","","","","DIA_GRD_251_Kirgo_Hello_Info.DIA_GRD_251_Kirgo_Hello.DIA_GRD_251_Kirgo_Hello_Yes","AI_AddChoice",""
"Content/Story/Missions/DIA_GRD_251_Kirgo.d:37","Tak.","Già.","","","Kirgo-CH0-None-Hero-61590","",""
"Content/Story/Missions/DIA_GRD_251_Kirgo.d:38","No to witaj w Kolonii. Jak ci na imię? Mnie nazywają Kirgo.","Beh, allora benvenuto nella Colonia, credo. Come ti chiami? Io sono Kirgo.","","","Kirgo-CH0-None-Kirgo-72322","",""
"Content/Story/Missions/DIA_GRD_251_Kirgo.d:39","Nyras.","Nyras.","","","Kirgo-CH0-None-Hero-54970","",""
"Content/Story/Missions/DIA_GRD_251_Kirgo.d:40","Miło poznać. Może chwilę porozmawiamy? Powiedz mi, jak się sprawy mają na zewnątrz, a ja zdradzę ci parę rzeczy, które ułatwią ci przeżycie w tej dziurze.","È un piacere conoscerti. Ehi, senti, perché non facciamo due chiacchiere? Potresti raccontarmi cos'è successo ultimamente là fuori, e io ti darò qualche consiglio per sopravvivere da queste parti. ","","","Kirgo-CH0-None-Kirgo-53995","",""
"Content/Story/Missions/DIA_GRD_251_Kirgo.d:41","Cały dzień przerzucam ten cholerny gruz. Chciałbym się na chwilę od tego oderwać... To jak, pogadamy?","È tutto il giorno che spalo quei dannati detriti, quindi farei qualsiasi cosa pur di distrarmi un po'. Che ne dici?","","","Kirgo-CH0-None-Kirgo-48505","",""
"Content/Story/Missions/DIA_GRD_251_Kirgo.d:47","Nie mam na to czasu.","","","","DIA_GRD_251_Kirgo_Hello_Yes.DIA_GRD_251_Kirgo_Hello.DIA_GRD_251_Kirgo_Hello_No_Time","AI_AddChoice",""
"Content/Story/Missions/DIA_GRD_251_Kirgo.d:48","No trudno.","","","","DIA_GRD_251_Kirgo_Hello_Yes.DIA_GRD_251_Kirgo_Hello.DIA_GRD_251_Kirgo_Hello_Too_Bad","AI_AddChoice",""
"Content/Story/Missions/DIA_GRD_251_Kirgo.d:49","A może opowiem ci w zamian za bezpieczny nocleg?","","","","DIA_GRD_251_Kirgo_Hello_Yes.DIA_GRD_251_Kirgo_Hello.DIA_GRD_251_Kirgo_Hello_Story_For_A_Place_To_Sleep","AI_AddChoice",""
"Content/Story/Missions/DIA_GRD_251_Kirgo.d:50","Dlaczego w ogóle obchodzi cię, co się dzieje na zewnątrz?","","","","DIA_GRD_251_Kirgo_Hello_Yes.DIA_GRD_251_Kirgo_Hello.DIA_GRD_251_Kirgo_Hello_Why_Are_You_Interested_In_This","AI_AddChoice",""
"Content/Story/Missions/DIA_GRD_251_Kirgo.d:56","Dlaczego w ogóle obchodzi cię, co się dzieje na zewnątrz? Przecież i tak się stąd nie wydostaniemy.","Perché ti interessa così tanto del mondo esterno, comunque? Non usciremo mai più, no?","","","Kirgo-CH0-None-Hero-5576","",""
"Content/Story/Missions/DIA_GRD_251_Kirgo.d:57","Ludzie z Nowego Obozu i typy żyjące na bagnie twierdzą inaczej. Ale masz rację, pewnie spędzimy tu resztę życia.","Beh, i tizi di Campo Nuovo e quegli altri nella palude non sono dello stesso avviso. Però sì, hai ragione, probabilmente non usciremo più. ","","","Kirgo-CH0-None-Kirgo-48595","",""
"Content/Story/Missions/DIA_GRD_251_Kirgo.d:58","Ja tam uważam, że warto sobie czasem przypomnieć, że świat nie kończy się na tej zasranej, niebieskiej kopule. Inaczej bym zwariował.","Tuttavia, penso che ogni tanto faccia bene ricordare che il mondo non finisce con quella stupida cupola blu. Impazzirei altrimenti.","","","Kirgo-CH0-None-Kirgo-58994","",""
"Content/Story/Missions/DIA_GRD_251_Kirgo.d:64","A może ci opowiem w zamian za bezpieczny nocleg?","Che ne dici se te ne parlo in cambio di un posto sicuro per dormire? ","","","Kirgo-CH0-None-Hero-57845","",""
"Content/Story/Missions/DIA_GRD_251_Kirgo.d:65","Może jedna z tych waszych chatek?","Tipo una delle tue capanne?","","","Kirgo-CH0-None-Hero-75065","",""
"Content/Story/Missions/DIA_GRD_251_Kirgo.d:66","Boisz się cieniostwora, co? Pozwoliłbym ci, gdyby to zależało ode mnie, ale tak nie jest. Przykro mi.","È per via di quella Bestia d'Ombra, eh? Ti lascerei dormire lì se dipendesse da me, ma non è così. Mi spiace, amico.","","","Kirgo-CH0-None-Kirgo-5289","",""
"Content/Story/Missions/DIA_GRD_251_Kirgo.d:73","No trudno.","Va bene.","","","Kirgo-CH0-None-Hero-75802-0","",""
"Content/Story/Missions/DIA_GRD_251_Kirgo.d:73","Szczerze, to nawet nie ma co tu dużo opowiadać. Każdy sra w gacie z powodu wojny, a wszystkie chore historie o orkach też nie pomagają.","In tutta onestà, comunque, non c'è così tanto da dire. Tutti sono in ansia per via della guerra, e tutte quelle dicerie che girano sugli Orchi non aiutano di certo. ","","","Kirgo-CH0-None-Hero-49599-0","",""
"Content/Story/Missions/DIA_GRD_251_Kirgo.d:74","Krąży jednak plotka, że Nordmarczycy odnieśli kilka małych zwycięstw. I tyle.","Si dice però che i Nordmariani abbiano ottenuto qualche piccola vittoria, se non altro. ","","","Kirgo-CH0-None-Hero-7847","",""
"Content/Story/Missions/DIA_GRD_251_Kirgo.d:75","Chwała Innosowi. Miejmy nadzieję, że uda im się odzyskać część kopalń. Nie ma znaczenia, ilu więźniów wyśle tu król – na dłuższą metę nie ma szans, żebyśmy nadążyli za popytem.","Grazie a Innos. Speriamo che riescano a riprendersi alcune aree minerarie - è impossibile che noi qui riusciremo a stare al passo con la richiesta sul lungo periodo, a prescindere da quanti prigionieri ci manderà il Re.","","","Kirgo-CH0-None-Kirgo-86946","",""
"Content/Story/Missions/DIA_GRD_251_Kirgo.d:76","A co z Khorinis? Miałeś szansę zobaczyć miasto, gdy cię tu przewozili?","Che mi dici di Khorinis? Sei riuscito a vederla mentre ti portavano qui?","","","Kirgo-CH0-None-Kirgo-51889","",""
"Content/Story/Missions/DIA_GRD_251_Kirgo.d:78","Niestety nie. Przez cały czas byłem zamknięty.","Non proprio. Sono stato rinchiuso tutto il tempo.","","","Kirgo-CH0-None-Hero-69630","",""
"Content/Story/Missions/DIA_GRD_251_Kirgo.d:78","Szkoda. Brakuje mi tego miasta. Mieszkałem tam przez kilka lat po opuszczeniu Varantu. Miałem nawet kobietę... Rosę.","Che peccato. Ah, amico, mi manca quel posto... Ci ho vissuto per un paio d'anni dopo che ho lasciato il Varant. Avevo una donna lì... Rosa.","","","Kirgo-CH0-None-Kirgo-15646","",""
"Content/Story/Missions/DIA_GRD_251_Kirgo.d:79","Nie wyobrażam sobie słodszej istoty. Była lepszym człowiekiem, niż ja kiedykolwiek będę.","Era la creatura più dolce che tu possa immaginare, e più buona di quanto io sarò mai in tutta la mia esistenza.  ","","","Kirgo-CH0-None-Kirgo-28860-0","",""
"Content/Story/Missions/DIA_GRD_251_Kirgo.d:82","Cholera, znowu zaczynam biadolić jak stary dziad. Wybacz.","Ah, merda, ecco che straparlo di nuovo come un vecchio bavoso. Scusami. ","","","Kirgo-CH0-None-Kirgo-50097","",""
"Content/Story/Missions/DIA_GRD_251_Kirgo.d:83","Czy to prawda, że w ogóle nie ma tu kobiet?","","","","DIA_GRD_251_Kirgo_Hello_Too_Bad.DIA_GRD_251_Kirgo_Hello.DIA_GRD_251_Kirgo_Hello_About_Women","AI_AddChoice",""
"Content/Story/Missions/DIA_GRD_251_Kirgo.d:87","Twoja kolej. Jakie masz dla mnie rady?","","","","DIA_GRD_251_Kirgo_Hello_Too_Bad.DIA_GRD_251_Kirgo_Hello.DIA_GRD_251_Kirgo_Hello_Any_Advice","AI_AddChoice",""
"Content/Story/Missions/DIA_GRD_251_Kirgo.d:93","Nie mam na to czasu.","Non ho tempo per queste cose.","","","Kirgo-CH0-None-Hero-42421","",""
"Content/Story/Missions/DIA_GRD_251_Kirgo.d:98","Hm, szkoda. No ale jak wolisz.","Hmm. Che peccato. Vabbè, è una tua decisione.","","","Kirgo-CH0-None-Kirgo-13085","",""
"Content/Story/Missions/DIA_GRD_251_Kirgo.d:104","Nie twój interes.","Non sono affari tuoi.","","","Kirgo-CH0-None-Hero-73711","",""
"Content/Story/Missions/DIA_GRD_251_Kirgo.d:104","Nie jesteś specjalnie rozmowny, co? Mnie to lata, ale radzę spuścić z tonu. Samotnicy szybko tu giną.","Non sei un tipo loquace, eh? A me sta bene, ma se fossi in te cambierei tono. I lupi solitari non fanno molta strada qui dentro. ","","","Kirgo-CH0-None-Kirgo-8473","",""
"Content/Story/Missions/DIA_GRD_251_Kirgo.d:113","Twoja kolej. Jakie masz dla mnie rady?","Ora tocca a te. Che consiglio hai per me?","","","Kirgo-CH0-G1RDemo_KirgoFight-Hero-99779","",""
"Content/Story/Missions/DIA_GRD_251_Kirgo.d:113","Dołącz do Starego Obozu. Jesteśmy sercem Kolonii. Wszystko, co wysyłają nam z zewnątrz, trafia do nas.","Unisciti a Campo Vecchio. Siamo il cuore della Colonia - tutto quel che arriva dall'esterno, finisce a noi.","","","Kirgo-CH0-G1RDemo_KirgoFight-Kirgo-70361","",""
"Content/Story/Missions/DIA_GRD_251_Kirgo.d:115","Chyba że osuną się skały...","Valanghe permettendo...","","","Kirgo-CH0-G1RDemo_KirgoFight-Hero-25026","",""
"Content/Story/Missions/DIA_GRD_251_Kirgo.d:115","Nie przejmuj się tym. Nasi chłopcy uporają się z tym w mgnieniu oka. Gomez jest surowy, ale wie, jak zarządzać tym miejscem.","Non preoccuparti, i nostri libereranno il sentiero in men che non si dica. Gomez è severo, ma sa come mandare avanti questo posto.","","","Kirgo-CH0-G1RDemo_KirgoFight-Kirgo-58252","",""
"Content/Story/Missions/DIA_GRD_251_Kirgo.d:117","Gomez? To twój szef?","""Gomez"" è il vostro leader?","","","Kirgo-CH0-G1RDemo_KirgoFight-Hero-59810","",""
"Content/Story/Missions/DIA_GRD_251_Kirgo.d:117","Jest najbardziej wpływowym człowiekiem w Starym Obozie. Poprowadził bunt więźniów i teraz tam rządzi.","Esatto, è l'uomo più potente di Campo Vecchio. Ha guidato la rivolta della prigione e da allora ha preso il comando.","","","Kirgo-CH0-G1RDemo_KirgoFight-Kirgo-34033","",""
"Content/Story/Missions/DIA_GRD_251_Kirgo.d:119","To on mówi królowi, czego chcemy w zamian za rudę, a król to dostarcza.","È lui a dire al Re cosa vogliamo in cambio del minerale. E il Re lo asseconda.","","","Kirgo-CH0-G1RDemo_KirgoFight-Kirgo-18590","",""
"Content/Story/Missions/DIA_GRD_251_Kirgo.d:120","Rozumiem.","Capisco.","","","Kirgo-CH0-G1RDemo_KirgoFight-Hero-26319","",""
"Content/Story/Missions/DIA_GRD_251_Kirgo.d:120","Jeszcze jedno. Wyglądasz na kogoś, kto potrafi posługiwać się mieczem. Co powiesz na mały sparing?","Un'altra cosa - sembra che in passato tu abbia già impugnato una spada. Ti andrebbe di fare un po' di pratica?","","","Kirgo-CH0-G1RDemo_KirgoFight-Kirgo-52548","",""
"Content/Story/Missions/DIA_GRD_251_Kirgo.d:123","W przyszłym tygodniu czeka mnie walka. W zamian nauczę cię kilku sztuczek."," La prossima settimana ho un combattimento in programma, e potrei mostrarti qualche trucchetto in cambio.","","","Kirgo-CH0-G1RDemo_KirgoFight-Kirgo-630","",""
"Content/Story/Missions/DIA_GRD_251_Kirgo.d:125","Może za chwilę.","","","","DIA_GRD_251_Kirgo_Hello_Any_Advice.DIA_GRD_251_Kirgo_Hello.DIA_GRD_251_Kirgo_Hello_Maybe_Later","AI_AddChoice",""
"Content/Story/Missions/DIA_GRD_251_Kirgo.d:126","Dobrze, czemu nie.","","","","DIA_GRD_251_Kirgo_Hello_Any_Advice.DIA_GRD_251_Kirgo_Hello.DIA_GRD_251_Kirgo_Hello_Why_Not","AI_AddChoice",""
"Content/Story/Missions/DIA_GRD_251_Kirgo.d:127","Wybacz, ale muszę lecieć.","","","","DIA_GRD_251_Kirgo_Hello_Any_Advice.DIA_GRD_251_Kirgo_Hello.DIA_GRD_251_Kirgo_Hello_Sorry_But_No","AI_AddChoice",""
"Content/Story/Missions/DIA_GRD_251_Kirgo.d:131","„Czeka cię walka”?","","","","DIA_GRD_251_Kirgo_Hello_Any_Advice.DIA_GRD_251_Kirgo_Hello.DIA_GRD_251_Kirgo_Hello_Are_You_Going_To_Fight","AI_AddChoice",""
"Content/Story/Missions/DIA_GRD_251_Kirgo.d:134","„Czeka cię walka”?","Hai un ""combattimento in programma""?","","","Kirgo-CH0-G1RDemo_KirgoFight-Hero-1372","",""
"Content/Story/Missions/DIA_GRD_251_Kirgo.d:138","Tak, na arenie. Będziesz mógł ją zobaczyć.","Sì, nell'arena. Vedrai.","","","Kirgo-CH0-G1RDemo_KirgoFight-Kirgo-68105","",""
"Content/Story/Missions/DIA_GRD_251_Kirgo.d:145","Wybacz, ale muszę lecieć.","Mi spiace, devo davvero andare.","","","Kirgo-CH0-G1RDemo_KirgoFight-Hero-91130","",""
"Content/Story/Missions/DIA_GRD_251_Kirgo.d:151","Trudno. Może innym razem.","Che peccato. Beh, magari un'altra volta.","","","Kirgo-CH0-G1RDemo_KirgoFight-Kirgo-3837","",""
"Content/Story/Missions/DIA_GRD_251_Kirgo.d:154","Dobrze, czemu nie.","Certo, perché no.  ","","","Kirgo-CH0-G1RDemo_KirgoFight-Hero-95013","",""
"Content/Story/Missions/DIA_GRD_251_Kirgo.d:158","Świetnie! Daj znać, jak będziesz gotowy.","Fantastico! Fammi solo sapere quando sei pronto.","","","Kirgo-CH0-G1RDemo_KirgoFight-Kirgo-63047","",""
"Content/Story/Missions/DIA_GRD_251_Kirgo.d:162","Może za chwilę.","","","","DIA_GRD_251_Kirgo_Hello_Why_Not.DIA_GRD_251_Kirgo_Hello.DIA_GRD_251_Kirgo_Ready_To_Fight_Maybe_Later","AI_AddChoice",""
"Content/Story/Missions/DIA_GRD_251_Kirgo.d:164","Jestem gotowy do walki.","","","","DIA_GRD_251_Kirgo_Hello_Why_Not.DIA_GRD_251_Kirgo_Hello.DIA_GRD_251_Kirgo_Ready_To_Fight_I_Am_Ready","AI_AddChoice",""
"Content/Story/Missions/DIA_GRD_251_Kirgo.d:236","Dobrze. Ja się nigdzie nie wybieram.","Sì, certo. Mi tratterrò ancora per un po'.","","","Kirgo-CH0-G1RDemo_KirgoFight-Kirgo-41448","",""
"Content/Story/Missions/DIA_GRD_251_Kirgo.d:185","Czy to prawda, że w ogóle nie ma tu kobiet?","È vero che non ci sono donne qui dentro? Nemmeno una?","","","Kirgo-CH0-None-Hero-24591","",""
"Content/Story/Missions/DIA_GRD_251_Kirgo.d:186","Są, ale tylko te sprowadzone przez Magnatów, by spełniały ich zachcianki. Uważaj, bo jeśli zawiesisz na którejś oko, Gomez każe cię wychłostać.","Solo quelle che i baroni delle miniere tengono per il proprio divertimento. Ma se solo provi a guardarle, Gomez ti farà frustare a sangue. ","","","Kirgo-CH0-None-Kirgo-12464","",""
"Content/Story/Missions/DIA_GRD_251_Kirgo.d:189","Krążą plotki o jakiejś parze, która uciekła i gdzieś się ukrywa, ale ja w to nie wierzę. Ludzie uwielbiają gadać... i chlać... a potem gadać jeszcze więcej.","Si mormora di una coppia che è fuggita e si sta nascondendo da qualche parte, ma ne dubito. La gente adora blaterare... e bere... e poi blaterare ancora.","","","Kirgo-CH0-None-Kirgo-85213","",""
"Content/Story/Missions/DIA_GRD_251_Kirgo.d:218","Może za chwilę.","","","","DIA_GRD_251_Kirgo_Ready_To_Fight_Info.DIA_GRD_251_Kirgo_Ready_To_Fight.DIA_GRD_251_Kirgo_Ready_To_Fight_Maybe_Later","AI_AddChoice",""
"Content/Story/Missions/DIA_GRD_251_Kirgo.d:225","Jestem gotowy do walki.","","","","DIA_GRD_251_Kirgo_Ready_To_Fight_Info.DIA_GRD_251_Kirgo_Ready_To_Fight.DIA_GRD_251_Kirgo_Ready_To_Fight_I_Am_Ready","AI_AddChoice",""
"Content/Story/Missions/DIA_GRD_251_Kirgo.d:279","Jestem gotowy do walki.","Sono pronto a combattere.","","","Kirgo-CH0-G1RDemo_KirgoFight-Hero-64994","",""
"Content/Story/Missions/DIA_GRD_251_Kirgo.d:300","Czekaj, tak bez broni? Załatw sobie jakąś. Bez tego to jak szczać pod wiatr.","Come, senza un'arma? Prima procuratene una, altrimenti non avrai nessuna chance.","","","Kirgo-CH0-G1RDemo_KirgoFight-Kirgo-39679","",""
"Content/Story/Missions/DIA_GRD_251_Kirgo.d:330","Oj, jak boli... tego się nie spodziewałem. Niezły jesteś... masz potencjał. Ale i tak mogę cię nauczyć paru sztuczek. Zainteresowany?","Ahia... Beh, non me l'aspettavo. Non male... hai del potenziale. Tuttavia, credo di poterti insegnare qualche trucco. Ti interessa?","","","Kirgo-CH0-G1RDemo_KirgoFight-Kirgo-87315","",""
"Content/Story/Missions/DIA_GRD_251_Kirgo.d:336","To była dobra walka! Nic ci nie złamałem?","Bel combattimento! Spero di non averti fatto male?","","","Kirgo-CH0-G1RDemo_KirgoFight-Kirgo-35355","",""
"Content/Story/Missions/DIA_GRD_251_Kirgo.d:337","... Chyba przeżyję.","... Va tutto bene.","","","Kirgo-CH0-G1RDemo_KirgoFight-Hero-61657","",""
"Content/Story/Missions/DIA_GRD_251_Kirgo.d:340","To dobrze. Nie walczysz źle, kolego. Musisz trochę poćwiczyć, ale masz potencjał. Chcesz, żebym nauczył cię paru sztuczek?","Lieto di sentirlo. Non sei male, amico mio - hai bisogno di fare un po' di pratica, ma hai del potenziale. Vuoi che ti insegni qualche trucchetto? ","","","Kirgo-CH0-G1RDemo_KirgoFight-Kirgo-59331","",""
"Content/Story/Missions/DIA_GRD_251_Kirgo.d:341","Pewnie, czemu nie.","Certo, perché no.","","","Kirgo-CH0-G1RDemo_KirgoFight-Hero-54063-0","",""
"Content/Story/Missions/DIA_GRD_251_Kirgo.d:342","No dobra. Po pierwsze, gdy posługujesz się taką bronią, trzymaj ją jedną ręką, a nie obiema. Gdy nabierzesz nieco mięśni, będziesz znacznie zwinniejszy, co pozwoli ci płynnie łączyć ataki.","Molto bene. Numero uno, quando usi un'arma così, impugnala con una mano, non due. Dopo che ti sarai fatto un po' di muscoli, sarai molto più agile e potrai combinare più attacchi.","","","Kirgo-CH0-G1RDemo_KirgoFight-Kirgo-565-0","",""
"Content/Story/Missions/DIA_GRD_251_Kirgo.d:346","Po drugie, jeśli podczas wyprowadzania ataku zdasz sobie sprawę, że odsłoni cię to na ripostę przeciwnika, wycofaj się i wykonaj unik. Wymaga to nieco treningu, ale poradzisz sobie.","Due, se stai per colpire e ti rendi conto che il nemico è in una posizione di vantaggio, arretra ed evita il suo colpo. Ti ci vorrà un po' di pratica, ma ce la puoi fare.","","","Kirgo-CH0-G1RDemo_KirgoFight-Kirgo-95345-0","",""
"Content/Story/Missions/DIA_GRD_251_Kirgo.d:352","Pamiętaj też, aby podczas parowania wyczuć idealny moment. Po idealnej paradzie twój przeciwnik będzie podatny na atak.","Infine, quando pari, fallo con il giusto tempismo, così da aprire la guardia del tuo avversario. ","","","Kirgo-CH0-G1RDemo_KirgoFight-Kirgo-10101","",""
"Content/Story/Missions/DIA_GRD_251_Kirgo.d:353","Rozumiem. Dzięki.","Va bene, ho capito. Grazie.","","","Kirgo-CH0-G1RDemo_KirgoFight-Hero-55473","",""
"Content/Story/Missions/DIA_GRD_251_Kirgo.d:357","Pamiętaj również, żeby parować w idealnym momencie. Dzięki temu wybijesz wroga z równowagi i będziesz mógł zaatakować.","Infine, quando pari, cerca di farlo con il giusto tempismo. Sbilancerà il tuo avversario e ti darà l'occasione per colpire.","","","Kirgo-CH0-G1RDemo_KirgoFight-Kirgo-35698","",""
"Content/Story/Missions/DIA_GRD_251_Kirgo.d:364","Rozumiem. Dzięki.","Va bene, ho capito. Grazie.","","","Kirgo-CH0-G1RDemo_KirgoFight-Hero-55473-0","",""
"Content/Story/Missions/DIA_GRD_251_Kirgo.d:367","Do usług. Lepiej znajdź sobie jakieś obozowisko. Zaczyna się ściemniać.","Figurati. Ora dovresti proprio cercare un accampamento, però - presto sarà buio. ","","","Kirgo-CH0-G1RDemo_KirgoFight-Kirgo-83210","",""
"Content/Story/Missions/DIA_GRD_251_Kirgo.d:375","Do usług. Lepiej znajdź sobie jakieś obozowisko. Zaczyna się ściemniać.","Figurati. Ora dovresti proprio cercare un accampamento, però - presto sarà buio. ","","","Kirgo-CH0-G1RDemo_KirgoFight-Kirgo-83210-0","",""
"Content/Story/Missions/DIA_GRD_251_Kirgo.d:396","Właściwie to dlaczego jesteś taki przyjazny?","","","","DIA_GRD_251_Kirgo_Why_Are_You_Nice.description","",""
"Content/Story/Missions/DIA_GRD_251_Kirgo.d:399","Właściwie to dlaczego jesteś taki przyjazny?","Comunque, perché sei così amichevole?","","","Kirgo-CH0-G1RDemo_KirgoFight-Hero-21333","",""
"Content/Story/Missions/DIA_GRD_251_Kirgo.d:399","Mówisz, jakby było w tym coś złego. Sam nie wiem. Może dlatego, że pozostali tutaj wyglądają, jakby nie srali od lat, więc próbuję to jakoś zrównoważyć.","Lo dici come se fosse una brutta cosa. Non saprei. Forse è perché la gente da queste parti si comporta come se non cagasse da anni, quindi io cerco di riequilibrare un po' le cose.","","","Kirgo-CH0-G1RDemo_KirgoFight-Kirgo-42430-0","",""
"Content/Story/Missions/DIA_GRD_251_Kirgo.d:427","Co powiesz na rewanż?","","","","DIA_GRD_251_Kirgo_About_Rematch.description","",""
"Content/Story/Missions/DIA_GRD_251_Kirgo.d:435","Co powiesz na rewanż?","Che ne dici di una rivincita?","","","Kirgo-CH0-G1RDemo_KirgoFight-Hero-57048","",""
"Content/Story/Missions/DIA_GRD_251_Kirgo.d:436","Tak szybko? Pewnie. Powiedz kiedy.","Come, di già? Certo. Dimmi quando sei pronto.","","","Kirgo-CH0-G1RDemo_KirgoFight-Kirgo-48441","",""
"Content/Story/Missions/DIA_GRD_251_Kirgo.d:440","Daj mi chwilę.","","","","DIA_GRD_251_Kirgo_About_Rematch_Info.DIA_GRD_251_Kirgo_About_Rematch.DIA_GRD_251_Kirgo_About_Rematch_Wait","AI_AddChoice",""
"Content/Story/Missions/DIA_GRD_251_Kirgo.d:442","Tym razem się nie powstrzymuj. Daj z siebie wszystko.","","","","DIA_GRD_251_Kirgo_About_Rematch_Info.DIA_GRD_251_Kirgo_About_Rematch.DIA_GRD_251_Kirgo_About_Rematch_No_Mercy","AI_AddChoice",""
"Content/Story/Missions/DIA_GRD_251_Kirgo.d:451","Walczmy.","","","","DIA_GRD_251_Kirgo_About_Rematch_Info.DIA_GRD_251_Kirgo_About_Rematch.DIA_GRD_251_Kirgo_About_Rematch_Fight","AI_AddChoice",""
"Content/Story/Missions/DIA_GRD_251_Kirgo.d:454","Hm, czemu nie. Tylko najpierw skombinuj sobie jakąś broń.","Hmm, perché no. Prima però procurati un'arma.","","","Kirgo-CH0-G1RDemo_KirgoFight-Kirgo-70786","",""
"Content/Story/Missions/DIA_GRD_251_Kirgo.d:464","Walczmy.","Combattiamo.","","","Kirgo-CH0-G1RDemo_KirgoFight-Hero-23822","",""
"Content/Story/Missions/DIA_GRD_251_Kirgo.d:464","Dobrze. Pokaż, co potrafisz!","Va bene. Mostrami cosa sai fare!","","","Kirgo-CH0-G1RDemo_KirgoFight-Kirgo-18035","",""
"Content/Story/Missions/DIA_GRD_251_Kirgo.d:473","Tym razem się nie powstrzymuj. Daj z siebie wszystko.","Stavolta non trattenerti. Impegnati fino in fondo.","","","Kirgo-CH0-G1RDemo_KirgoFight-Hero-92998","",""
"Content/Story/Missions/DIA_GRD_251_Kirgo.d:474","Jesteś pewny? No dobrze, zatańczmy.","Ne sei sicuro? Va bene, diamoci da fare.","","","Kirgo-CH0-G1RDemo_KirgoFight-Kirgo-72913","",""
"Content/Story/Missions/DIA_GRD_251_Kirgo.d:483","Daj mi chwilę.","Dammi un attimo.","","","Kirgo-CH0-G1RDemo_KirgoFight-Hero-17711","",""
"Content/Story/Missions/DIA_GRD_251_Kirgo.d:487","Dobrze. Wiesz, gdzie mnie szukać.","Va bene. Sai dove trovarmi.","","","Kirgo-CH0-G1RDemo_KirgoFight-Kirgo-27576","",""
"Content/Story/Missions/DIA_GRD_251_Kirgo.d:520","Nieźle... Tego się nie spodziewałem.","Non male... non l'avevo previsto.","","","Kirgo-CH0-None-Kirgo-65501","",""
"Content/Story/Missions/DIA_GRD_251_Kirgo.d:522","Dobra walka. Idzie ci coraz lepiej!","Bel combattimento. Stai imparando!","","","Kirgo-CH0-None-Kirgo-22502","",""
"Content/Story/Missions/DIA_GRD_251_Kirgo.d:522","Muszę wracać do roboty. Do zobaczenia.","Ad ogni modo, devo rimettermi al lavoro adesso. Ci vediamo.","","","Kirgo-CH0-None-Kirgo-30285-0","",""
